{
  "id": "shiji-maling-jianzhu",
  "title": "马陵减灶：庞涓是被自己的确信杀死的",
  "actors": ["庞涓", "孙膑", "田忌", "太子申"],
  "era": "战国魏惠王时",
  "source": { "book": "史记", "chapter": "孙子吴起列传" },
  "kernel": ["过度自信", "信息采信"],
  "situation": "魏攻韩，韩求救于齐。齐以田忌为将、孙膑为师，直走大梁——围魏救韩。庞涓释韩而还，追击齐军。此刻的信息战场：孙膑对庞涓的判断力了如指掌（同窗、又曾亲手设计其妒忌之心——膑脚之仇在先），而庞涓对孙膑的认知却停在「那个被我看穿、被我废掉的人」。孙膑的对策不是隐藏信息，而是制造信息：他故意让庞涓「看见」齐军的崩溃。",
  "options": [
    { "option": "稳步跟进，与主力同步", "assessment": "程序安全；但齐军若真怯逃，缓慢跟进将放跑歼敌战机——「谨慎」本身也可能是对敌人的配合。" },
    { "option": "据灶数判断后全力追歼", "assessment": "庞涓的数据依据成立（灶减=兵溃）；前提是灶数未被操纵——他没有检验这个前提，因为他的自我认知里不存在「孙膑敢算计我」这个假设。" },
    { "option": "疑敌止步，请示再动", "assessment": "错失战机且示怯于魏廷；太子申为副，政治成本同样高昂。" }
  ],
  "choice": "孙膑令齐军入魏地先为十万灶，明日为五万灶，又明日为三万灶——一个逐日坍缩的「兵败如山倒」信号。庞涓行三日，大喜曰：「我固知齐军怯，入吾地三日，士卒亡者过半矣。」乃弃其步军，与其轻锐倍日并行逐之。孙膑度其行，暮当至马陵——「马陵道陕，而旁多阻隘，可伏兵」，乃斫大树白而书之曰「庞涓死于此树之下」，令万弩夹道而伏，约「暮见火举而俱发」。庞涓夜至，见白书，燃火读之，未毕，「齐军万弩俱发，魏军大乱相失。庞涓自知智穷兵败，乃自刭，曰：『遂成竖子之名！』」齐乘胜尽破魏军，虏魏太子申。",
  "reasoning": "庞涓的死因链：①数据是真的，样本是假的——「入吾地三日，士卒亡者过半」从灶数推演完全合乎军事逻辑，他唯一没问的问题是：灶是给谁看的？②确认偏误的闭环：他「固知」齐军怯——这个先验来自早年对孙膑的胜利与加害，敌人在他心里已经完成了「怯懦化」归档，此后一切信息都往这个档案里归；③轻锐倍日并行的双重赌：为追歼「溃兵」放弃步军主力、日夜倍程深入敌境——把机动性押在了一个未经检验的判断上；④对手的狠处在于：孙膑的每一层设计（减灶、白书、火举）都以庞涓的「聪明」为前提——火光下读「庞涓死于此树之下」，是一个只属于聪明人的死法。",
  "outcome": {
    "short_term": "魏军精锐尽失，太子申被虏；魏国自马陵之败一蹶不振，霸权终结。",
    "long_term": "孙膑之名由此定于天下，《孙膑兵法》流传后世；「减灶」成为诱敌深入的教科书原型，「马陵道」成为轻敌者之地标。庞涓临终那句「遂成竖子之名」一语成谶：他的死讯本身就是孙膑的成名作。"
  },
  "original_text": [
    { "quote": "使齐军入魏地为十万灶，明日为五万灶，又明日为三万灶。庞涓行三日，大喜，曰：「我固知齐军怯，入吾地三日，士卒亡者过半矣。」乃弃其步军，与其轻锐倍日并行逐之。", "citation": "史记·孙子吴起列传" },
    { "quote": "孙子度其行，暮当至马陵。马陵道陕，而旁多阻隘，可伏兵，乃斫大树白而书之曰「庞涓死于此树之下」。……齐军万弩俱发，魏军大乱相失。庞涓自知智穷兵败，乃自刭，曰：「遂成竖子之名！」", "citation": "史记·孙子吴起列传" }
  ],
  "insight": [
    "所有被你「确认」的信息，都值得再问一句：它是天然产生的，还是被设计给我看的？——数据可以是真的，数据的呈现方式可以是陷阱。",
    "先验一旦完成「敌人怯懦化/对手低能化」的归档，确认偏误就开始自动运行：你不再检验假设，只是反复收集支持它的证据。庞涓不是没智力，是智力被自尊劫持。",
    "轻锐倍日并行：为了追赶一个想象中的战果，愿意放弃全部冗余（步军、粮道、谨慎）——过度自信的标志性行为不是狂妄的言语，而是冗余的消失。",
    "对手研究你的方式，往往比你研究自己更系统：孙膑给庞涓定制的每个信号，都是按「庞涓会怎么想」反向设计的——你的自我认知，就是敌人可利用的接口。"
  ],
  "risks": [
    "现代对应：尽调数据可以真实而仍具误导性——卖方给你的每张报表、竞对放出的每个溃败信号、候选人面试里的完美表现，都可能是「减灶」。关键问题是：谁控制着数据的生成过程？",
    "「我固知」是三个字的高危信号：当你发现自己在用「我早就知道」替代新的验证动作时，强制做一次反方推演——如果对手想让我看到这个，我该做什么？",
    "不要把此案读成「谨慎万能」：稳步跟进同样可能错失战机。真正的解法是给「追击」加一层独立验证（派别部核实战场、留预备队、设折返条件），而不是全有或全无。"
  ],
  "modern_scenarios": ["尽调数据会不会是做给我看的", "轻敌冒进与错失战机的两难", "对老对手/老同事的刻板判断", "关键决策前的独立验证通道"],
  "paired_cases": ["shiji-changping-huanjiang", "tongjian-guanyu-jingzhou", "tongjian-xuanzong-jujing"],
  "keywords": ["轻敌", "确认偏误", "减灶", "诱敌", "数据陷阱", "马陵", "孙膑", "庞涓", "冒进", "尽调", "过度自信", "验证"]
}
