{
  "id": "tongjian-taizong-yongren",
  "title": "用人如器：「当代无奇才」是最贵的自我开脱",
  "actors": ["唐太宗", "封德彝"],
  "era": "唐贞观初",
  "source": { "book": "资治通鉴", "chapter": "卷一百九十二·唐纪八" },
  "kernel": ["用人识人"],
  "situation": "贞观初，天下初定，官僚体系亟需重建，太宗令尚书右仆射封德彝举贤。久无所举——一个手握人事大权的宰相，对「举贤」这件事交了白卷。德彝的答辞是所有时代面试官的通用托辞：「非不尽心，但于今未有奇才耳。」这个回答的潜台词结构：人才=完美的候选人=上个时代的功臣模板；按这个标准，任何时代都「没有人才」，而托辞者永远免责。",
  "options": [
    { "option": "接受「当代无才」，跨代挖人或长期空缺", "assessment": "承认本朝无人等于政治自杀；跨代挖人（借才于异代）在物理上不可能——这个选项荒谬到恰好暴露前提的荒谬。" },
    { "option": "降低标准凑数，建立庸人平衡", "assessment": "填满编制但生产平庸；且求全责备的筛选器不变，选出来的仍是最会通过筛选的人。" },
    { "option": "换框架：从「找完人」改为「用人如器，各取所长」", "assessment": "把人才评估从绝对评分改为岗位-长处匹配；同时把「举贤」设定为宰相的本职KPI，堵死托辞空间。" }
  ],
  "choice": "太宗直接驳回并反转责任：「君子用人如器，各取所长。古之致治者，岂借才于异代乎？正患己不能知，安可诬一世之人！」——锅从「时代无人」翻回「你识人无能」。贞观一朝随之展开整套实践：魏征来自李建成旧阵营，尉迟敬德是降将，戴胄以忤旨执法见用，马周以中郎将门客代笔上书被破格直取御史——不问出身与旧属，只问长处与岗位的匹配。",
  "reasoning": "太宗的判断：①识破「无才论」的真实功能——免责声明。举错人要担责，说「没有」不用担责，于是理性官僚都选择报告「没有」；对策不是劝，而是改变激励：举贤是宰相本职，不举即失职，托辞从此比举错更贵。②器用观的重构力：把「这个人完美吗」换成「这个器皿适合盛什么」——先拆解岗位的核心产出，再去配长处，绝对评分里的「缺点」在匹配视角下多数无关紧要。③组织生态逻辑：「诬一世之人」是有代价的——所有人都听到你说当代无才，真正的人才要么流失要么躺平，无才论会自我实现。",
  "outcome": {
    "short_term": "贞观年间人才井喷：房玄龄杜如晦谋断相济、魏征诤谏、李靖李勣典兵、马周戴胄各效其长——一个刚从战乱里走出来的朝廷，成为后世公认的「人才密度天花板」。",
    "long_term": "「用人如器，各取所长」成为中国管理思想史上被引用最多的人才观之一。它的反面教训同样留在本库：用人识别的失败样本见长平换将（用错了长处）、才德之辨（把标准错配成单维度）。"
  },
  "original_text": [
    { "quote": "上令封德彝举贤，久无所举。上诘之，对曰：「非不尽心，但于今未有奇才耳！」上曰：「君子用人如器，各取所长。古之致治者，岂借才于异代乎？正患己不能知，安可诬一世之人！」德彝惭而退。", "citation": "资治通鉴·卷一百九十二·唐纪八" }
  ],
  "insight": [
    "「我们这没有人才」几乎总是「我的识人框架有缺陷」的委婉说法——求全责备的筛选器下，天才与庸才一起被过滤。",
    "先拆岗位，再配长处：器用观的操作顺序决定了它的成败。拿完美画像筛人，得到的是伪装完美的人；按功能配器，得到的是能交付的团队。",
    "人才密度首先是激励与制度的产物（举贤是本职+免责设计+破格通道），其次才是领导者的眼光——制度先于天赋。",
    "宣称「无才」有组织级代价：它会顺着层级传染成人才流失与躺平，最终自我实现。"
  ],
  "risks": [
    "「各取所长」不等于容忍短板：适用于长处能覆盖核心产出的岗位；对风险敏感岗位（财务、合规、安全），硬底线不参与「长处交换」。",
    "器用观的阴暗面是功利化——「用完即弃」会让下一代人才藏起长处自保（对照周亚夫案：组织如何对待用完的器，决定后来者敢不敢亮出来）。",
    "警惕把「用人如器」读成一切为岗位让路的工具主义：被当器皿用的人是会走的，现代组织中长处交换必须兑现为成长与回报。"
  ],
  "modern_scenarios": ["招聘追求完美简历而长期空缺岗位", "团队组建：按岗位功能配长处而非凑资历", "「我们行业没人才」的借口识别", "内部破格（马周路径）vs 空降 hire"],
  "paired_cases": ["tongjian-zhibo-caide", "shiji-changping-huanjiang"],
  "keywords": ["招聘", "人才", "识人", "用人所长", "团队组建", "完美候选人", "破格提拔", "借才", "面试", "人才密度", "组队", "短板"]
}
