{
  "id": "shiji-xiaohe-zifu",
  "title": "萧何自污：被最高权力猜忌时的三张自保牌",
  "actors": ["萧何", "刘邦", "召平", "客（隐名谋士）"],
  "era": "汉初",
  "source": { "book": "史记", "chapter": "萧相国世家" },
  "kernel": ["功高震主", "进退去留"],
  "situation": "萧何位居相国、功列第一，坐镇关中十余年，深得民望——这恰恰是他的危险所在。刘邦在外征讨，三次猜忌三次试探，萧何身边先后三拨人给他上牌：①汉三年刘邦在前线频使者「劳苦」萧何，鲍生点破：这是疑心，不是慰问；②汉十一年诛韩信后，刘邦加封五千户并派五百人卫队「保护」相国，满朝道贺，召平独吊：「祸自此始矣」；③汉十二年征黥布时刘邦反复遣使打听「相国在干什么」，客说破：上所问者，畏君倾动关中——民望即威胁。",
  "options": [
    { "option": "继续做清官、攒民望、当好后勤总理（默认路径）", "assessment": "个人声誉最优解；但在猜忌结构里，民望是负资产——你在前线的声誉每加一分，后方君主的疑心就加一分。" },
    { "option": "让封、献家财佐军（召平牌）", "assessment": "退还赏赐、输送利益，把「封赏」从宠信信号重新解读为试探信号并当面戳破之——风险是当面否定君主的表演。" },
    { "option": "自污名、毁清望（客牌）", "assessment": "贱价强买民田、放贷自贬，主动把「贤相爱民」的人设换成「贪财小气」的人设；代价是真实的社会性折价，收益是猜忌无处着落。" }
  ],
  "choice": "萧何三张牌全用了：依鲍生计，遣子孙昆弟能胜兵者悉诣军所（送人质）；依召平计，让封勿受、悉以家私财佐军（退利益）；依客计，多买田地、贱贳贷以自污（毁清望）。刘邦果然「乃大喜」「乃大说」。但萧何没有在自污后止步——班师后百姓拦路上书告相国贱强买民田数千万，刘邦表面把诉状丢给他「君自谢民」，随后萧何又为民请上林苑空地，刘邦翻脸下狱械系。数日后经王卫尉进言方赦出，萧何徒跣入谢，君臣做戏收场：「吾故系相国，欲令百姓闻吾过也。」",
  "reasoning": "三条自保逻辑共同指向同一原理：君主的恐惧对象不是你的资产，而是你的号召力。①送人质——把家族利益与你个人的忠绑定，抵押品要真金白银；②退利益——把加封视为「置卫卫君」的羞辱性试探，主动揭穿并退还，成本最低；③毁清望——「自污」的本质是拆掉君主看不见、拆不掉、因而最恐惧的那部分：民心。萧何的失误恰恰在第三步之后：他误判自污已完全解锁猜忌，于是旧习复发为民请命——这又是在积累民望。刘邦下狱一击，是把「我仍然可以随时办你」重新打回桌面的展示性行为，萧何以恭谨徒跣完成收尾，君臣默契复位。",
  "outcome": {
    "short_term": "三牌连出，每次刘邦都「大说/大喜」；但请苑一案仍下狱数日，受尽折辱。",
    "long_term": "萧何终得善终（惠帝二年卒，谥文终侯），但代价是自毁清名、下狱受系。同期对照：韩信夷三族，张良辟谷全身——功高震主的诸位，无人拿到「既全名又全命」的选项。"
  },
  "original_text": [
    { "quote": "鲍生谓何曰：「王暴衣露盖，数使使劳苦君者，有疑君心也。为君计，莫若遣君子孙昆弟能胜兵者悉诣军所，上必益信君。」于是何从其计，汉王大说。", "citation": "史记·萧相国世家" },
    { "quote": "召平谓相国曰：「祸自此始矣。……夫置卫卫君，非以宠君也。愿君让封勿受，悉以家私财佐军，则上心说。」何从其计，高帝乃大喜。", "citation": "史记·萧相国世家" },
    { "quote": "客有说相国曰：「君灭族不久矣。……今君胡不多买田地，贱贳贷以自污？上心乃安。」于是相国从其计，上乃大说。", "citation": "史记·萧相国世家" },
    { "quote": "上曰：「相国休矣！相国为民请苑，吾不许，我不过为桀纣主，而相国为贤相。吾故系相国，欲令百姓闻吾过也。」", "citation": "史记·萧相国世家" }
  ],
  "insight": [
    "猜忌结构里，美名即负债：君主清算的对象从来不是「坏事做绝的人」，而是「号召力可能盖过自己的人」。民望、清誉、拥趸，都是需要定期折价管理的资产。",
    "被猜忌时，对方往往在用「加封、派卫队、频繁慰问」做戏，识破表演并主动补位（让封、送质、自污），比被动等待信任更有效。",
    "自保策略有保质期：自污解锁的信任额度是有限的，一旦误判额度（萧何请苑），之前的三张牌全部需要重打。",
    "与张良「在场的退出」相比，萧何示范的是「在场的贬值」——不能离开体系的人，可以选择性损坏自己最危险的那部分资产。"
  ],
  "risks": [
    "「自污」绝不可迁移为现代组织中的真实违规（造假、吃回扣、违反合规）——现代制度下那不叫自污，叫留把柄，且审计不留情面。可迁移的内核是：刻意降低「凝聚力号召力」的显示度（少聚人气、不养私谊山头、把功劳归因于平台与老板）。",
    "萧何案的现代映射更多是「被审计被盯防时期的行为管理」：越是敏感期，越要避免任何可被解读为「经营个人势力」的动作。",
    "注意成本核算：萧何付出的代价是历史清名与牢狱之辱。这类策略换的是安全，不是体面——既想要安全又想要清名的人（周亚夫型），两个都保不住。"
  ],
  "modern_scenarios": ["功劳太大被老板盯防，如何管理老板的不安全感", "空降老板频繁「慰问」你的团队意味着什么", "功勋老臣如何降低自己的政治存在感", "敏感期该低调到什么程度"],
  "paired_cases": ["shiji-wangjian-qingtianzhai", "shiji-zhangliang-tuiyin", "shiji-zhouyafu-end"],
  "keywords": ["猜忌", "自污", "表忠心", "让利", "人质", "民望", "清誉", "被防", "自保", "低调", "敏感期", "功臣"]
}
