{
  "id": "tongjian-peiju-junming",
  "title": "裴矩佞隋诤唐：底线是环境的函数吗",
  "actors": ["裴矩", "隋炀帝", "唐太宗"],
  "era": "隋大业—唐武德/贞观之际",
  "source": { "book": "资治通鉴", "chapter": "卷一百九十二·唐纪八" },
  "kernel": ["利益与底线", "纳谏倾听"],
  "situation": "裴矩，历仕北齐、隋、唐三朝的顶级官僚。在隋炀帝朝，他是「佞臣」的标准样本：经营西域时揣摩帝意、诱使番邦入朝粉饰太平；江都兵变前后更献最不堪一策——把江都女子征集起来配给卫士以稳军心，炀帝「大喜，立即照办」。入唐之后，同一个裴矩变了：唐太宗「患吏多受赇」，密使左右「试赂」官吏，有个司门令史受绢一匹，太宗欲杀之——裴矩当廷反对：「为吏受赂，罪诚当死。但陛下使人遗之而受，乃陷人于法也，恐非所谓『道之以德，齐之以礼』。」太宗大悦，召集五品以上官员宣布：「裴矩能当官力争，不为面从，傥每事皆然，何忧不治！」",
  "options": [
    { "option": "在隋朝的语境里直言（反事实推演）", "assessment": "参照系：炀帝朝因进谏被杀者不绝（谏止巡游者多被处死）——直言的成本是生命，而皇帝的问题无解。" },
    { "option": "在唐朝也保持沉默（路径依赖）", "assessment": "个人最安全；但贞观初的试赂钓鱼本身是个错误政策（诱人犯罪再重罚），无人反对则恶例既成。" },
    { "option": "读环境、再决定敢不敢（实际行为轨迹）", "assessment": "裴矩的两副面孔不是精神分裂，是同一套「谏言成本算法」在两个制度环境下的不同输出。" }
  ],
  "choice": "裴矩的行为轨迹：隋朝——顺着皇帝的每一个错误供料（含江都之策这种遗臭级别的主意）；唐朝——钓鱼执法刚冒头就当廷硬顶。判若两人，同一个人。司马光在通鉴中为此写下著名论断：「臣光曰：古人有言：『君明臣直。』裴矩佞于隋而忠于唐，非其性之有变也。君恶闻其过则忠化为佞，君乐闻直言则佞化为忠。是知君者表也，臣者景也，表动则景随矣。」——君主是测影之表，臣子是影子，表动了影子才动。",
  "reasoning": "①裴矩的底层算法从未变过：评估「直言的预期收益/成本」，隋朝的函数输出沉默与逢迎（成本=死），唐朝的函数输出诤谏（成本=零，收益=「能当官力争」的政治资产）——变的是函数的参数，不是函数本身；②司马光的批评对象因此不是裴矩而是制度：把忠佞归因于臣下人品，会掩盖「君恶闻其过」这个系统性根因——影子没有自己的颜色；③唐太宗一侧同样重要：「试赂」是个道德上有瑕疵的政策（钓鱼诱罪），但他能当场接受被驳、并当众表扬反对者——「傥每事皆然，何忧不治」是把这一次纳谏广播成制度信号；④现代管理学对读：员工行为是激励与容错环境的函数——「公司里没有说真话的人」，第一句话该问的是「说真话的人后来都怎么样了」。",
  "outcome": {
    "short_term": "试赂钓鱼政策被驳回，恶例未成；裴矩获「不为面从」的公开背书。",
    "long_term": "「裴矩佞于隋而忠于唐」成为组织行为学的古典案例：同一个人在坏系统里放大系统的恶、在好系统里贡献系统的善——个人底线叙事与系统决定论在此相撞。裴矩八十一岁卒，谥曰敬。"
  },
  "original_text": [
    { "quote": "臣光曰：「古人有言：『君明臣直。』裴矩佞于隋而忠于唐，非其性之有变也。君恶闻其过则忠化为佞，君乐闻直言则佞化为忠。是知君者表也，臣者景也，表动则景随矣。」", "citation": "资治通鉴·卷一百九十二·唐纪八" },
    { "quote": "矩曰：「为吏受赂，罪诚当死。但陛下使人遗之而受，乃陷人于法也，恐非所谓『道之以德，齐之以礼』。」上悦，集文武五品以上谓曰：「裴矩能当官力争，不为面从，傥每事皆然，何忧不治！」", "citation": "资治通鉴·卷一百九十二·唐纪八" }
  ],
  "insight": [
    "「君者表也，臣者景也」：组织成员的行为是环境的函数——先看系统给「说真话」定的价格，再评价个人的沉默或发言。",
    "同一个人的两副面孔是诊断书：当一个「能臣」在系统 A 阿谀、在系统 B 硬顶，该被审视的不是他的品格，而是两个系统的容错结构。",
    "表扬一次反对，胜过颁布十项纳谏制度：太宗的「集五品以上告之」把单次纳谏广播成激励信号——说真话的声誉定价由此建立。",
    "警惕「钓鱼式治理」：诱人违法再重罚，短期震慑、长期腐蚀合法性——裴矩驳的不是杀一儆百的力度，是那个「陷人于法」的动作本身。"
  ],
  "risks": [
    "系统决定论不能豁免个人：裴矩在隋朝的江都之策已远超「明哲保身」，是主动作恶——环境解释行为，但不豁免选择；对个人而言，离开坏系统的成本必须被诚实计入，而不是用「环境如此」自我开脱。",
    "对管理者的提醒：你的组织里「裴矩浓度」是可测的——如果同一个能干的人在别家公司敢言、在你这里缄默，问题清单第一行写的是你的纳谏成本结构，不是招聘失误。",
    "「表动景随」也有反向推论：个人在坏系统里长期停留，影子会真的改变颜色（品行侵蚀）——及时离场不只是策略，是自我保护。"
  ],
  "modern_scenarios": ["坏公司里的能干人为什么变油", "向上级说真话的成本结构", "钓鱼式合规检查的副作用", "组织纳谏环境的自我诊断"],
  "paired_cases": ["tongjian-weizheng-renjing", "shiji-fuzhai-wuzixu", "tongjian-luntai-zuiji"],
  "keywords": ["君明臣直", "说真话", "环境", "底线", "纳谏", "钓鱼执法", "明哲保身", "佞臣", "忠臣", "组织文化", "容错", "裴矩"]
}
