{
  "id": "shiji-changping-huanjiang",
  "title": "长平换将：用纸面天才替换实战老将",
  "actors": ["赵孝成王", "赵括", "廉颇", "蔺相如", "赵母"],
  "era": "战国·赵",
  "source": { "book": "史记", "chapter": "廉颇蔺相如列传" },
  "kernel": ["用人识人", "信息采信"],
  "situation": "长平之战，廉颇坚壁固守，「赵军固壁不战」，与秦相持——这是打不赢但输不掉的正确消耗策略，代价是赵王难以承受的粮草消耗和「怯战」观感。秦国散布反间：「秦之所恶，独畏马服君赵奢之子赵括为将耳。」赵括名声极大：「自少时学兵法，言兵事，以天下莫能当」，连其父赵奢都辩不过他。赵王面临换将决策，两位最懂行的人（蔺相如、赵括之母）先后强烈反对。",
  "options": [
    { "option": "维持廉颇的固守消耗策略", "assessment": "财政压力巨大、政治上难看，但不给白起野战歼灭的机会，国本可保。" },
    { "option": "换赵括，转入决战", "assessment": "若赵括真有其名，可速胜解套；但其全部履历是「谈兵」而无实战，且情报源头恰是敌国。用四十余万主力去验证一个未经验证的人。" }
  ],
  "choice": "赵王换赵括。蔺相如谏：「括徒能读其父书传，不知合变也」，不听。赵括之母上书「括不可使将」，并转述赵奢生前判断：「兵，死地也，而括易言之……破赵军者必括也」，又指出赵括与其父用兵时对待部下、财物的行为差异，赵王仍不听，其母遂求「即有如不称，妾得无随坐乎」。",
  "reasoning": "赵王的判断失误链：①把「言胜」当「能胜」——赵括无可辩驳的口才被当作能力证据；②情报未审源——「畏赵括」之说恰出自秦国反间，动机审查缺位；③被财政与政治压力推着做决定，把「需要速胜」偷换成「可以速胜」；④两位反对者给出的都是行为证据（不知合变、轻言死地、吝财待下），赵王用名声压倒了证据。",
  "outcome": {
    "short_term": "赵括至军「悉更约束，易置军吏」，主动出击。秦密遣白起为上将军。赵军被断粮道、分割包围四十六日，「阴相杀食」。",
    "long_term": "赵括自出锐卒搏战，被射杀；「括军败，卒四十余万人降武安君」，白起尽坑之，「赵前后所亡凡四十五万」。赵国自此一蹶不振。其母因事先声明而得免坐。"
  },
  "original_text": [
    { "quote": "秦之间言曰：「秦之所恶，独畏马服君赵奢之子赵括为将耳。」赵王因以括为将，代廉颇。蔺相如曰：「王以名使括，若胶柱而鼓瑟耳。括徒能读其父书传，不知合变也。」赵王不听，遂将之。", "citation": "史记·廉颇蔺相如列传" },
    { "quote": "赵括自少时学兵法，言兵事，以天下莫能当。尝与其父奢言兵事，奢不能难，然不谓善。括母问奢其故，奢曰：「兵，死地也，而括易言之。使赵不将括即已，若必将之，破赵军者必括也。」", "citation": "史记·廉颇蔺相如列传" },
    { "quote": "括军败，卒四十余万人降武安君……乃挟诈而尽坑杀之，遗其小者二百四十人归赵。前后斩首虏四十五万人。赵人大震。", "citation": "史记·白起王翦列传" }
  ],
  "insight": [
    "「谈论水平」与「实战水平」是两种能力，前者可以完美伪装后者；识人要用实绩证据链，而非言谈说服力——「奢不能难，然不谓善」是最高明的识人姿态：辩不过你，但不认为你行。",
    "凡是「敌人/竞对最怕谁」类情报，第一步先审发布者动机——你听到的最怕，可能正是对方最想要。",
    "最了解候选人的人（其父其母）给出的负面评价，信息价值远高于市场名声；内部人反对声被名声淹没是用人事故的常见前兆。",
    "压力下决策的自检：把「我需要这个方案成功」和「这个方案会成功」分开写下来，看证据各有多少。",
    "赵母「得无随坐」的操作：无力阻止错误决策时，至少书面留痕、切割责任。"
  ],
  "risks": [
    "不可反推「名校/理论背景=纸上谈兵」；赵括的问题不是懂理论，而是零实战履历直接接手最高杠杆的任务。渐进加杠杆可以兼得。",
    "维持廉颇策略同样有真实代价（财政枯竭），本案不证明保守永远正确，只证明「用未验证的人押上全部筹码」错误。",
    "现代招聘中「面试表现极佳」正是赵括式信号，需用作品、实绩、背调交叉验证。"
  ],
  "modern_scenarios": ["高管招聘中面试满分但无实绩的候选人", "临阵更换项目负责人", "竞对放话「最怕你们做某方向」要不要信"],
  "paired_cases": ["tongjian-zhibo-caide", "tongjian-guandu-xuyou"],
  "keywords": ["用人", "招聘", "换将", "纸上谈兵", "面试", "名声", "实绩", "反间", "情报", "背调", "压力决策"]
}
