{
  "id": "tongjian-banchao-huxue",
  "title": "不入虎穴：三十六人的深夜豪赌",
  "actors": ["班超", "鄯善王广"],
  "era": "东汉明帝时",
  "source": { "book": "资治通鉴", "chapter": "卷四十五·汉纪三十七" },
  "kernel": ["高风险押注", "关键决断"],
  "situation": "永平十六年，班超以假司马身份率三十六人出使西域，首站鄯善。起初「王广礼敬甚备」，数日后忽然疏懈——班超从礼数突变这个小信号判断：匈奴使团也到了，鄯善王正在两边摇摆。此刻的处境结构：三十六人对匈奴使团百余人，鄯善全国站在墙外观望；窗口只有一两天——一旦鄯善决定绑了汉使送给匈奴，全员骸骨长为豺狼食。请兵来不及（往返数千里的窦固大营），示弱等于等死。",
  "options": [
    { "option": "速报窦固大营请兵再动", "assessment": "程序正确；但路途遥远，兵至则人已为虏——「等」本身就是死。" },
    { "option": "与鄯善王摊牌，逼其表态站汉", "assessment": "王已被匈奴使团吓住，摊牌只会逼他当场倒向强者。" },
    { "option": "趁夜火攻，歼匈奴使团", "assessment": "三十六人打百余人，纸面劣势；但夜暗+火攻+鼓噪可以制造「不知我多少」的信息不对称。胜则鄯善举国震怖、献质归汉；败则全灭。" }
  ],
  "choice": "班超先设局验证判断：骗鄯善侍者「匈奴使来数日，今安在乎」，侍者惶恐说出实情——信号确认。随后召集部下饮酒，酒酣直言利害：「今虏使到裁数日，而王广礼敬即废；如今鄯善收吾属送匈奴，骸骨长为豺狼食矣」，众人请死从司马。当夜大风，三十六人分两路：十人持鼓藏虏舍后，余人持弓弩夹门而伏，顺风纵火、前后鼓噪，虏众惊乱中百余人被殄灭。次日提匈奴使者首级示鄯善王，「一国震怖」，鄯善纳子为质，归附汉朝。",
  "reasoning": "班超的判断链：①从最小信号读出最大变量（礼敬即废→匈奴使团必至），且立即用设局验证，不让猜测悬着发酵；②把「要不要赌」重新表述为「哪边是必死」——请兵是必死，摊牌是必死，唯独赌局里还有概率；③赔率工程：用夜、风、火、鼓噪把人数劣势换成信息不对称，使对方误判兵力，这是以小搏大的正确姿势——不是降低赌注，而是抬高赢面；④先说服部下共担（酒酣陈利害），三十六人变成一个统一的行动单元，而不是三十六个可能的逃兵或告密者。",
  "outcome": {
    "short_term": "鄯善归附、纳质；窦固上其功，明帝擢超为军司马，再使西域。",
    "long_term": "班超以数十人的使团在西域纵横三十一年，不劳中国之兵而五十余国内属，官至西域都护，封定远侯；七十一岁上疏「生入玉门」，归洛阳，当年卒。三十六人的那把火，烧出了东汉在西域三十年的存在。"
  },
  "original_text": [
    { "quote": "超曰：「今虏使到裁数日，而王广礼敬即废；如今鄯善收吾属送匈奴，骸骨长为豺狼食矣。……」官属曰：「今在危亡之地，死生从司马！」", "citation": "资治通鉴·卷四十五·汉纪三十七" },
    { "quote": "超曰：「不入虎穴，不得虎子。当今之计，独有因夜以火攻虏，使彼不知我多少，必大震怖，可殄尽也。灭此虏，则鄯善破胆，功成事立矣。」", "citation": "资治通鉴·卷四十五·汉纪三十七" },
    { "quote": "会天大风，超令十人持鼓藏虏舍后，约曰：「见火然，皆当鸣鼓大呼。」余人悉持弓弩，夹门而伏。超乃顺风纵火，前后鼓噪，虏众惊乱，超手格杀三人，吏兵斩其使及从士三十余级，余众百许人悉烧死。明日，还白固……鄯善一国震怖。", "citation": "资治通鉴·卷四十五·汉纪三十七" }
  ],
  "insight": [
    "以小搏大的核心不是胆量，是赔率设计：把己方的每一分劣势（人少）换成对方的信息劣势（不知我多少），赌局才从「碰运气」变成「有数学」。",
    "当不行动等于必死时，风险偏好应当整个翻转——此时「求稳」才是最大的冒险。班超案的难点不在敢赌，而在识别出「自己已站在死地」。",
    "信号判读能力决定窗口利用率：礼数疏懈这种细枝末节里藏着生死变量；发现后先用低成本手段验证（诈问侍者），再全押。",
    "孤胆不孤立：行动前用利害把团队变成共同体——先统一内部，再面对外部。"
  ],
  "risks": [
    "班超有「将在外」的授权空间（假司马使西域，人不在朝廷眼皮底下），且事后立即向窦固复命。现代职场不要把「先斩后奏」当常规打法——先确认你的授权边界和事后申报通道，否则这不是豪赌而是自毁。",
    "「不入虎穴」常被滥用为匹夫之勇的口号。本案例的前置条件缺一不可：信号已验证、选项已穷尽（等与谈都是死）、赔率已设计、团队已统一。缺任何一条，正确答案都是撤。",
    "赢了赌局的人容易把运气复用为方法论。班超此后三十年靠的不是再赌，而是把火攻一夜换来的威望，转化为长期外交与制度存在。"
  ],
  "modern_scenarios": ["谈判中发现对手在接触你的替代方，窗口只剩几天", "小团队要抢在大公司反应之前锁定关键合作", "拿到一个小信号，如何低成本验证重大猜想", "要不要先斩后奏"],
  "paired_cases": ["shiji-lvbuwei-qihuo", "tongjian-chibi-zhanhe"],
  "keywords": ["不入虎穴焉得虎子", "夜袭", "以少胜多", "孤注一掷", "先斩后奏", "赔率", "谈判窗口", "死地", "抢跑", "授权边界", "信息不对称", "验证"]
}
