{
  "id": "shiji-xiangyu-julu",
  "title": "破釜沉舟：把退路烧掉的那一天",
  "actors": ["项羽", "宋义", "章邯", "王离"],
  "era": "秦末",
  "source": { "book": "史记", "chapter": "项羽本纪" },
  "kernel": ["高风险押注", "关键决断"],
  "situation": "秦军围巨鹿，章邯、王离主力在此，诸侯救军十余壁屯于外围，「莫敢纵兵」。楚怀王以宋义为上将军、项羽为次将北上救赵；宋义行至安阳，留四十六日不进，主张「承敝击倦」坐收渔利——而时天寒大雨，士卒冻饥。军权结构脆弱：名义主帅在等，实际主战者在沸。项羽晨朝上将军帐中，斩宋义头，威震楚国。先遣当阳君、蒲将军二万人渡河，战少利，陈馀复请兵——增量的两万人不够，接下来怎么办？",
  "options": [
    { "option": "继续观望，等秦赵两疲", "assessment": "宋义路线已用四十六天验证过：诸侯观望的囚徒困境里，观望者永远等不到「两疲」。" },
    { "option": "渐进增兵，保留主力作为战略预备", "assessment": "符合兵法常规；但诸侯十余壁都在看着楚军敢不敢先拼命——半吊子投入既打不破王离，也收不了诸侯之心。" },
    { "option": "全军渡河，物理销毁全部退路，三日军粮内决战", "assessment": "把「撤退」从选项菜单里删除；赢了通吃诸侯，输了全军尽没——筹码是楚军全部与项羽本人的性命。" }
  ],
  "choice": "「项羽乃悉引兵渡河，皆沉船，破釜甑，烧庐舍，持三日粮，以示士卒必死，无一还心。」于是围王离，与秦军遇，九战，绝其甬道，大破之，杀苏角，虏王离。当时「诸侯军救巨鹿下者十余壁，莫敢纵兵。及楚击秦，诸将皆从壁上观。楚战士无不一以当十，楚兵呼声动天，诸侯军无不人人惴恐」。战后项羽召见诸侯将，「入辕门，无不膝行而前，莫敢仰视。项羽由是始为诸侯上将军，诸侯皆属焉」。",
  "reasoning": "破釜沉舟不是勇气表演，是一套精密的机制设计：①不可逆的承诺机制（commitment device）——烧掉船和锅，等于用物理手段把士卒的期望结构从「打得赢就打、打不赢就跑」改写为「三日内唯一的活路是赢」，全员行动函数被强制统一；②三日粮是精确的窗口声明：不是无限决绝，而是给这场豪赌设定了明确的结算周期——赌注有界，战果必须在这个窗口内兑现；③时机三要素齐备：主帅已诛（军权在手）、敌军围城久疲（结构脆弱）、诸侯围观（舆论杠杆）；④豪赌的收益远不止军事：一场当众的胜利完成对诸侯的权力定价——「膝行而前」的那一刻，项羽买的其实是霸主的定价权。⑤历史的黑色对照：五年后垓下，同样是不留退路的项羽，用同一套逻辑对「不肯过江东」——一个习惯销毁退路的人，最后也会这样销毁自己的。",
  "outcome": {
    "short_term": "巨鹿大捷，秦军主力崩溃；诸侯皆属，项羽成为反秦联军实际统帅。",
    "long_term": "三年而亡秦分天下；又五年，垓下自刎——「破釜沉舟」与「不肯过江东」是同一个人格的两面：前者成就了他，后者杀死了他。不留退路是工具，不是性格；把工具活成性格的人，会在绝境里替工具殉葬。"
  },
  "original_text": [
    { "quote": "项羽乃悉引兵渡河，皆沉船，破釜甑，烧庐舍，持三日粮，以示士卒必死，无一还心。于是至则围王离，与秦军遇，九战，绝其甬道，大破之，杀苏角，虏王离。", "citation": "史记·项羽本纪" },
    { "quote": "诸侯军救巨鹿下者十余壁，莫敢纵兵。及楚击秦，诸将皆从壁上观。楚战士无不一以当十，楚兵呼声动天，诸侯军无不人人惴恐。", "citation": "史记·项羽本纪" },
    { "quote": "项羽召见诸侯将，入辕门，无不膝行而前，莫敢仰视。项羽由是始为诸侯上将军，诸侯皆属焉。", "citation": "史记·项羽本纪" }
  ],
  "insight": [
    "「销毁退路」的效力来自机制而非情绪：它不是激昂的口号，而是对全员期望结构的物理改写——要让团队只能向一个方向用力，就删掉另一个方向的出口。",
    "豪赌必须有明确的结算周期：三日粮=给赌注上界。没有时限的孤注一掷不是决绝，是慢性自杀。",
    "当众的豪赌有杠杆效应：所有观望者都在看你是否敢先下注——敢，则观望者的资源开始向你倾斜；这一层政治收益常常大于赌局本身的军事收益。",
    "破釜沉舟是工具不是人格：在战场上销毁退路是策略，在人生里销毁退路是绝症——项羽用一生演示了这条分界线。"
  ],
  "risks": [
    "现代「破釜沉舟」式创业/转型成立的前提有三个，缺一不可：窗口物理存在（三日粮内真有一场决定性战斗——而不是无限期的市场消耗）；执行者已被验证（项羽的战场能力是既定事实，不是赌出来的）；对手结构可破（围城的秦军有甬道、有分营，弱点明确）。三缺一，孤注一掷只是自杀。",
    "给自己留一条「你不可接受但存在的退路」：项羽至死不懂这个。现代对应——all-in 之前留好个人破产边界、家庭安全垫、可回归的职业底线；这些不是懦弱，是让下次下注成为可能的资本。",
    "警惕用「背水一战」动员团队做不设时限的消耗战：三天粮的决绝让人热血，三年粮的决绝让人崩溃——时限与透明是动员的底线。"
  ],
  "modern_scenarios": ["要不要 all-in 一个项目/赛道", "团队动员：如何让大家没有二心", "背水一战的成立条件检查", "all-in 的个人安全垫怎么留"],
  "paired_cases": ["shiji-lvbuwei-qihuo", "tongjian-banchao-huxue", "shiji-xiangyu-wujiang"],
  "keywords": ["破釜沉舟", "背水一战", "孤注一掷", "all-in", "决绝", "退路", "动员", "不可逆", "决战", "期权清零", "豪赌", "承诺机制"]
}
