{
  "id": "shiji-lvbuwei-qihuo",
  "title": "奇货可居：倾家押注一个落魄质子",
  "actors": ["吕不韦", "子楚（异人）"],
  "era": "战国末",
  "source": { "book": "史记", "chapter": "吕不韦列传" },
  "kernel": ["高风险押注"],
  "situation": "阳翟大商人吕不韦在邯郸见到秦国质子异人（子楚）：秦昭王之孙、安国君二十余子中排行居中、生母失宠、被扔在敌国当人质，「车乘进用不饶，居处困，不得意」。但吕不韦看到了结构性机会：安国君已立为太子，其正夫人华阳夫人无子——继承人位置实际空悬。他与父亲算过账：耕田之利十倍，珠玉之赢百倍，「立国家之主赢几倍？」曰：「无数。」",
  "options": [
    { "option": "倾其资本运作子楚上位（分两笔各五百金：一笔养子楚结宾客，一笔购奇物贿赂华阳夫人一系）", "assessment": "回报「无数」；但链条极长：华阳夫人肯认、安国君肯立、子楚能活着回国、安国君和昭王的寿命顺序……任一环断裂即血本无归，且以商人身份卷入敌国王位斗争，有性命风险。" },
    { "option": "继续经商，赚确定的百倍之利", "assessment": "低风险稳定复利，但永远只是商人，「泽不可遗世」。" }
  ],
  "choice": "全力押注。「乃以五百金与子楚，为进用，结宾客；而复以五百金买奇物玩好，自奉而西游秦」，通过华阳夫人之姊说动华阳夫人，「刻玉符，约以为适嗣」。邯郸围城时又「行金六百斤予守者吏」救子楚脱身。",
  "reasoning": "吕不韦的投资逻辑：①标的被严重错误定价——子楚的血统期权（王孙+嫡位空悬）市场上无人识别；②他找到了撬动全局的杠杆点——不是讨好掌权者，而是解决掌权链条上关键人物（华阳夫人）自己的痛点：「以色事人者，色衰而爱弛」，无子的她需要一个认养的继承人来锁定后半生地位；③投入拆分成可分步验证的两笔，并非一次性梭哈。",
  "outcome": {
    "short_term": "华阳夫人立子楚为嫡嗣。昭王卒，安国君立一年而卒，子楚即位为庄襄王，「以吕不韦为丞相，封为文信侯，食河南雒阳十万户」——回报兑现，确实「无数」。",
    "long_term": "但深度绑定王权的仓位无法退出：庄襄王三岁而卒，秦王政立，尊吕不韦为相国、仲父，权倾天下；后受嫪毐之乱牵连罢相，秦王赐书切责「君何功于秦……何亲于秦」，吕不韦「恐诛，乃饮酖而死」。"
  },
  "original_text": [
    { "quote": "吕不韦贾邯郸，见而怜之，曰：「此奇货可居。」", "citation": "史记·吕不韦列传" },
    { "quote": "归而谓父曰：「耕田之利几倍？」曰：「十倍。」「珠玉之赢几倍？」曰：「百倍。」「立国家之主赢几倍？」曰：「无数。」曰：「今力田疾作，不得暖衣余食；今建国立君，泽可以遗世。愿往事之。」", "citation": "史记·吕不韦列传" },
    { "quote": "秦王十年十月，免相国吕不韦……秦王恐其为变，乃赐文信侯书曰：「君何功于秦？秦封君河南，食十万户。君何亲于秦？号称仲父。其与家属徙处蜀！」吕不韦自度稍侵，恐诛，乃饮酖而死。", "citation": "史记·吕不韦列传" }
  ],
  "insight": [
    "顶级押注的共性：标的被市场错误定价（人人见落魄质子，吕不韦见血统期权），且下注者掌握别人没有的撬动路径（华阳夫人的痛点）。",
    "说服关键人的正解不是陈述自己的利益，而是解决对方的存量焦虑——「色衰爱弛、无子无靠」才是华阳夫人签约的真实理由。",
    "长链条押注要拆分成可分步验证的投入（两笔五百金分工明确），而非一次性梭哈。",
    "本案必须整案看完：投资的成功（封侯十万户）与结局的败亡（饮酖）同源——回报高到「无数」的仓位，往往也大到无法退出。押注成功后的退出设计，和押注本身同等重要。"
  ],
  "risks": [
    "极端幸存者偏差：昭王、安国君恰好接连速死，子楚三年登顶——寿命顺序这一最大变量纯属运气。同样的操作，安国君多活二十年就是完全不同的故事。",
    "「押注一个人」的仓位无法止损也无法减持，与押注一个可退出的资产有本质区别。",
    "以「回报无数」为由押上输不起的东西（身家性命）在现代对应「全部积蓄+借贷创业/重仓」，需先问：归零后能否重来？",
    "吕不韦终局警示：与至高权力深度绑定的收益，其所有权最终由权力单方面解释。"
  ],
  "modern_scenarios": ["全部积蓄押注早期创业公司/合伙人", "放弃大厂高薪加入前途未卜的初创", "重注投资一个「被低估的人」"],
  "paired_cases": ["shiji-fanli-wenzhong"],
  "keywords": ["押注", "投资", "创业", "梭哈", "风险投资", "识人", "低估", "赌一把", "全部身家", "回报", "退出机制"]
}
