{
  "id": "shiji-fanli-wenzhong",
  "title": "泛舟五湖 vs 称病不朝：大功告成之后，走还是留",
  "actors": ["范蠡", "文种"],
  "era": "春秋末",
  "source": { "book": "史记", "chapter": "越王句践世家" },
  "kernel": ["进退去留", "功高震主"],
  "situation": "范蠡、文种辅佐句践二十余年，灭吴称霸，是复国的两大功臣。霸业已成，两人手握巨大功劳与声望——这在君主眼中正从「资产」变成「威胁」。范蠡对句践的判断是「可与同患，难与处安」。此刻退出通道尚开：主动请辞还来得及。",
  "options": [
    { "option": "立即放弃全部地位财富，彻底离开", "assessment": "损失确定且巨大（上将军之位、封地），但换取不可估价的安全；离开后凭本事可再起。" },
    { "option": "留下享受胜利果实", "assessment": "地位、财富、荣光都在眼前；但功高震主，且句践的性格决定了功臣的下场高度不确定。" },
    { "option": "半退：称病不朝，保留身份", "assessment": "想两头兼得：不交出功臣身份，又降低存在感。但在君主眼中，「若有若无的功臣」恰是最可疑的状态。" }
  ],
  "choice": "范蠡选择彻底离开：辞句践，「装其轻宝珠玉，自与其私徒属乘舟浮海以行，终不反」。并写信劝文种：「蜚鸟尽，良弓藏；狡兔死，走狗烹。越王为人长颈鸟喙，可与共患难，不可与共乐。子何不去？」文种选择第三条路：「见书，称病不朝。」",
  "reasoning": "范蠡的判断依据有二：其一是对人的判断——从句践的相貌性情断定其只可共患难；其二是对局的判断——「大名之下，难以久居」，功劳的边际价值已为零，而其带来的猜忌在持续复利。文种则舍不得沉没成本，选择了最危险的中间态：既未消除威胁感，又放弃了主动权。",
  "outcome": {
    "short_term": "范蠡浮海入齐，变名鸱夷子皮；文种称病在家，随即被人进谗「且作乱」。",
    "long_term": "范蠡三度迁徙、三致千金，成为陶朱公，善终，史称「范蠡三徙，成名于天下」。文种被句践赐剑：「子教寡人伐吴七术，寡人用其三而败吴，其四在子，子为我从先王试之。」文种遂自杀。"
  },
  "original_text": [
    { "quote": "范蠡遂去，自齐遗大夫种书曰：「蜚鸟尽，良弓藏；狡兔死，走狗烹。越王为人长颈鸟喙，可与共患难，不可与共乐。子何不去？」种见书，称病不朝。", "citation": "史记·越王句践世家" },
    { "quote": "越王乃赐种剑曰：「子教寡人伐吴七术，寡人用其三而败吴，其四在子，子为我从先王试之。」种遂自杀。", "citation": "史记·越王句践世家" },
    { "quote": "范蠡浮海出齐……喟然叹曰：「居家则致千金，居官则至卿相，此布衣之极也。久受尊名，不祥。」乃归相印，尽散其财……而怀其重宝，间行以去，止于陶。", "citation": "史记·越王句践世家" }
  ],
  "insight": [
    "退出时机的判断标准：当你的价值对上位者从「有用」转为「已用完」，你的存在就从资产变成风险敞口。",
    "同一情报（越王可共患难不可共乐）两人都收到了，分岔点不在信息而在执行力：范蠡舍得沉没成本，文种舍不得。",
    "「半退」（称病不朝）往往是最差解：威胁感没消除，主动权先交了出去。要走就走干净。",
    "范蠡证明了核心能力可以迁移：真本事不依附于某个平台，离开平台后「三致千金」。"
  ],
  "risks": [
    "现代职场极少有杀身之祸，「裸辞式彻底退出」的收益结构与古代不同，不必机械模仿其决绝程度；但「股权/期权套牢下的半退状态最危险」的结构依然成立。",
    "范蠡式退出的前提是可迁移的能力与可带走的资本；若个人价值完全绑定平台，退出前先解决这一点。",
    "「上位者可共患难不可共富贵」是对句践的具体判断，不是普适定律，勿以此绝对化揣测所有老板。"
  ],
  "modern_scenarios": ["公司上市/被收购后功臣团队去留", "帮老板打完硬仗后是否急流勇退", "留在体系内躺平（半退）还是干脆离开"],
  "paired_cases": ["shiji-zhangliang-tuiyin", "shiji-zhouyafu-end"],
  "keywords": ["功成身退", "退出时机", "离职", "套现", "鸟尽弓藏", "兔死狗烹", "老板猜忌", "急流勇退", "躺平", "沉没成本"]
}
