{
  "id": "tongjian-tandaoji-changcheng",
  "title": "自毁长城：檀道济之死",
  "actors": ["宋文帝", "刘义康", "刘湛", "檀道济"],
  "era": "南朝宋元嘉十三年（436）",
  "source": { "book": "资治通鉴", "chapter": "卷一百二十三·宋纪五" },
  "kernel": ["功高震主", "用人识人"],
  "situation": "檀道济是刘宋开国的活化石：随武帝刘裕南征北战，威名冠于一时，麾下心腹薛彤、高进之「并经百战」，时人比之关张。宋文帝刘义隆常年病重，彭城王刘义康与领军刘湛实际执政——而刘湛「欲专朝政」，最忌惮的就是那个「一旦皇上驾崩，谁能驾驭得了」的檀道济。帝王的恐惧结构完整成型：主少国疑的预期 + 功高难制的战将 + 借病索权的窗口。元嘉十三年，文帝病重，道济已奉命出镇——走到码头，诏书追至。",
  "options": [
    { "option": "收其兵权、养于京师（软处置）", "assessment": "保留国防能力与政治缓冲；但刘湛们要的不是兵权，是「死人比活人安全」。" },
    { "option": "外放边镇、远离中枢（原计划）", "assessment": "两全的表象；但在「主上病重、权臣摄政」的结构里，外镇重将恰恰是最可疑的存在。" },
    { "option": "假传圣旨收而杀之（实际选择）", "assessment": "一次性解决「身后谁能驾驭」的问题；代价是把国防体系最贵的一块资产当废料处理。" }
  ],
  "choice": "刘义康假称皇帝命令，召道济入朝设宴饯行，就地逮捕。诏书罗织「散金养士、乘朕疾笃、规谋不轨」之罪，与其子及薛彤、高进之一并诛杀。道济见收，「愤气盛，目光如炬，俄尔间引饮一斛，乃脱帻投地，曰：『乃坏汝万里长城！』」——你们在拆自己家的长城。魏人闻之道济死，弹冠相庆。十三年后（元嘉二十七年），文帝北伐大败，北魏太武帝拓跋焘饮马长江；文帝登上石头城北望，忧惧交集，叹曰：「檀道济若在，岂使胡马至此！」——说这话时，离他亲手批准杀死道济，已过去整整十四年。",
  "reasoning": "①文帝的账本上，道济的风险是「或有」的（病重时可能失控），成本却是「或有」的（魏军南侵也是可能）——他用一笔或有负债去清偿另一笔或有资产，赌的是「我不至于那么倒霉」；②刘湛的算计更冷：他不需要证明道济有罪，只需要证明「主崩之后无人能制」——这是结构判断而非事实判断，罗织的罪名只是结构判断的包装纸；③假传圣旨的程序安排暴露了诛杀的真实决策层级：真正的决策者不敢署名——连杀人都用「借用权力」的方式完成，说明这个系统里连恶都要匿名；④文帝的终局叹息是全案最贵的一句话：他到死都没明白，杀死「万里长城」的不是坏运气，是他自己的风险模型——把忠诚折价为威胁，把威胁折价为必须清除。",
  "outcome": {
    "short_term": "道济父子及二将俱死；朝廷「自谓社稷之固」，内部再无掣肘。",
    "long_term": "「乃坏汝万里长城」成为自毁栋梁的千古定语；元嘉北伐惨败、太武帝兵临瓜步，「元嘉草草，封狼居胥，赢得仓皇北顾」——辛弃疾一句词埋葬了这个王朝的野心。刘宋在自毁栋梁的路上停不下来：此后名将沈庆之、檀和之等相继被翦除，国势江河日下。"
  },
  "original_text": [
    { "quote": "道济见收，愤气盛，目光如炬，俄尔间引饮一斛。乃脱帻投地，曰：「乃坏汝万里长城！」", "citation": "资治通鉴·卷一百二十三·宋纪五" },
    { "quote": "上登石头城，有忧色，谓江湛曰：「北伐之计，同议者少。今日士民劳怒，不得无惭。……檀道济若在，岂使胡马至此！」", "citation": "资治通鉴·卷一百二十五·宋纪七" }
  ],
  "insight": [
    "「主崩之后谁能驾驭他」是权力场中最危险的问句：它不需要任何罪证就能启动清算——因为答案永远只有一个「无人能制」。识别这个信号（你的存在本身被当作风险）比自证清白更重要。",
    "用或有风险清除或有资产，是猜忌结构的标准账法：长城的价值平时不可见，敌人饮马长江时才显现——而那时资产已经销账。",
    "「借来的刀」透露真实决策链：假传圣旨、匿名作恶的系统里，连恶行都没有责任人——这种组织的结构性风险远大于任何一个具体坏人。",
    "十四年后的叹息不会还魂：文帝的「檀道济若在」证明——清算法目的成本往往由未来的自己支付，且复利计息。"
  ],
  "risks": [
    "站在管理者一侧：处理「功高难制」的问题人才，存在中间道路（轮岗、分权、明确继任架构、荣誉化安置），直接清零是治理破产的标志——檀道济案的组织教训是风险模型里缺了「外部威胁」这一行。",
    "站在人才一侧：当你的价值被重新定义为「身后无人能制」时，一切忠诚展示都无效（对照郭子仪案：透明化+不可替代性的正向用法）；此时的理性选项是提前规划退出或议价，而非加倍表忠。",
    "现代组织无「赐死」，但有等价物：核心专家被排挤、被竞对收割、被架空的成本，最终由组织自己承担——「自毁长城」在职场里的名字叫「骨干流失」。"
  ],
  "modern_scenarios": ["核心骨干被政治清算式的排挤", "组织自毁栋梁的隐性成本", "权臣与老将的结构性冲突", "被盯防者的退出与议价"],
  "paired_cases": ["shiji-zhouyafu-end", "tongjian-guozhiyi-zibao", "shiji-baiqi-juzhan"],
  "keywords": ["功高震主", "自毁长城", "檀道济", "清洗", "老将", "清算", "权臣", "政治斗争", "骨干流失", "元嘉北伐", "猜忌", "栋梁"]
}
