{
  "id": "tongjian-zhibo-caide",
  "title": "智伯之亡与才德之辨：选继承人，选最能干的还是最靠谱的",
  "actors": ["智宣子", "智伯（智瑶）", "智果", "司马光"],
  "era": "春秋末·晋",
  "source": { "book": "资治通鉴", "chapter": "卷一·周纪一" },
  "kernel": ["用人识人"],
  "situation": "晋国智宣子欲立智瑶为继承人。族人智果反对，给出精确评估：智瑶有五大过人之处——「美鬓长大则贤，射御足力则贤，伎艺毕给则贤，巧文辩慧则贤，强毅果敢则贤」，但有一项致命短板：「甚不仁」。智果的推演：「以其五贤陵人而以不仁行之，其谁能待之？若果立瑶也，智宗必灭。」这是一个典型的继承人/接班人选择问题：全维度顶配的能力 vs 单点致命的品行。",
  "options": [
    { "option": "立智瑶：能力全面碾压，可带领家族在四卿竞争中扩张", "assessment": "短期竞争力最强；但「五贤陵人+不仁」意味着他会用顶级能力去做树敌的事，且无人能制衡。" },
    { "option": "依智果之议改立他人（智宵）", "assessment": "能力平庸些，但不会以才行恶；家族走保守存续路线。" }
  ],
  "choice": "智宣子「弗听」，立智瑶。智果预见后果，「别族于太史为辅氏」——直接改姓分家避祸。",
  "reasoning": "智宣子的逻辑是朴素的能力择优：五项全能的候选人肉眼可见地优秀。他没有采纳智果的核心洞见：能力是乘数，品行是正负号——才能越强，作恶的杠杆越大。司马光在此案后写下著名的才德论：「才者，德之资也；德者，才之帅也……才德全尽谓之圣人，才德兼亡谓之愚人；德胜才谓之君子，才胜德谓之小人。凡取人之术，苟不得圣人、君子而与之，与其得小人，不若得愚人。」并点破原因：「君子挟才以为善，小人挟才以为恶。挟才以为善者，善无不至矣；挟才以为恶者，恶亦无不至矣。」",
  "outcome": {
    "short_term": "智伯执政后果然恃才凌人：戏康子而侮段规、索地于三家、当面羞辱他人而不设防（「难将由我，我不为难，谁敢兴之」）。",
    "long_term": "韩、魏、赵三家被逼至绝境后联手，「三家分智氏之田」，杀智伯，「尽灭智氏之族」，唯改姓的辅果一支得存。智果的两个预言（宗灭、避祸）全部兑现。三家分晋，战国开局。"
  },
  "original_text": [
    { "quote": "智果曰：「瑶之贤于人者五，其不逮者一也……如是而甚不仁。夫以其五贤陵人而以不仁行之，其谁能待之？若果立瑶也，智宗必灭。」弗听。智果别族于太史为辅氏。", "citation": "资治通鉴·卷一·周纪一" },
    { "quote": "才者，德之资也；德者，才之帅也……凡取人之术，苟不得圣人、君子而与之，与其得小人，不若得愚人。何则？君子挟才以为善，小人挟才以为恶。挟才以为善者，善无不至矣；挟才以为恶者，恶亦无不至矣。", "citation": "资治通鉴·卷一·周纪一（臣光曰）" },
    { "quote": "三家以国人围而灌之，城不浸者三版……赵襄子……与韩、魏合谋，以三月丙戌，三家反灭智氏，共分其地。", "citation": "资治通鉴·卷一·周纪一" }
  ],
  "insight": [
    "能力是乘数，品行是正负号：才胜德的人，能力越强破坏杠杆越大——「挟才以为恶者，恶亦无不至矣」。",
    "司马光给出可操作的排序：得不到德才兼备者时，宁取「德胜才」甚至「才德兼亡」，不取「才胜德」——因为愚人作恶「力不能胜」，小人作恶如「虎而翼者」。",
    "评估关键人选时，单点致命项（不仁/无底线）应有一票否决权，不与五项优点做加权平均。",
    "智果的第二层示范：当组织坚持错误的关键人事决策且你无力改变时，尽早做结构性切割（别族改姓），而非留下陪葬。"
  ],
  "risks": [
    "「德」的评估远比「才」难且易被表演污染；司马光的框架不解决识别问题，背调要看其在拥有权力时如何对待无还手之力的人。",
    "不可把「有个性、强势」误判为「不仁」；智瑶的问题是羞辱他人成瘾且无自省（「难将由我」），是品行而非风格。",
    "现代组织里一票否决制可能被滥用为排除异己的借口，「品行问题」需有具体行为证据。"
  ],
  "modern_scenarios": ["选接班人/合伙人：能力超强但人品存疑", "招明星高管时的品行背调", "跟着才华横溢但刻薄寡恩的老板有没有前途"],
  "paired_cases": ["shiji-changping-huanjiang"],
  "keywords": ["接班人", "合伙人", "人品", "才华", "德才", "背调", "选人", "一票否决", "刻薄", "识人"]
}
