{
  "id": "tongjian-weizheng-renjing",
  "title": "人镜已亡：如何让刺耳的真话持续到达决策者",
  "actors": ["唐太宗", "魏征", "长孙皇后"],
  "era": "唐·贞观",
  "source": { "book": "资治通鉴", "chapter": "卷一百九十二—一百九十六·唐纪" },
  "kernel": ["纳谏倾听"],
  "situation": "魏征原为太子建成幕僚，曾劝建成早除秦王。玄武门后，李世民召问：「汝何为离间我兄弟！」魏征举止自若答：「先太子早从征言，必无今日之祸。」太宗此刻的选择：杀之立威，还是纳之为谏臣。而其后近二十年，真正的难题是持续性的：帝王权力天然压制异见，如何让组织里最刺耳的声音不枯竭？",
  "options": [
    { "option": "诛杀或贬斥旧敌阵营的强硬派", "assessment": "立威、除隐患；但等于向全体官僚宣告「说真话且站错过队的人没有活路」，此后耳边只剩顺从。" },
    { "option": "超规格重用，并制度化保护其谏诤", "assessment": "个人忍受被当众顶撞的长期不适（太宗曾怒言「会须杀此田舍翁」）；但换来一个敢于「犯颜苦谏」的信息通道，以及示范效应。" }
  ],
  "choice": "太宗「改容礼之，引为詹事主簿」，后迁谏议大夫、秘书监、侍中，前后纳其谏二百余事。制度与姿态配套：明确鼓励「上不至天，下不至地」的直言；长孙皇后以「主明臣直」朝服贺谏，家庭层面再加固。魏征卒，太宗痛言：「人以铜为镜，可以正衣冠；以古为镜，可以见兴替；以人为镜，可以知得失。魏徵没，朕亡一镜矣！」",
  "reasoning": "太宗的核心认知：①帝王的最大信息风险是「人人知上意后只说上爱听的」，谏臣是唯一的纠偏机制；②魏征「站错队」恰是其价值证明——他对建成尽忠敢言，说明其直言是人格而非投机；③纳谏必须公开化、超额回报，因为观众是整个官僚系统：每处理一个魏征，都在给所有潜在直言者定价。反例在后：魏征死后太宗亲征高丽受挫，叹曰「魏徵若在，不使我有是行也」——镜亡之后，无人能拦住他。",
  "outcome": {
    "short_term": "旧敌阵营人心迅速安定；谏诤成为贞观朝风，王珪、马周、褚遂良等直臣辈出。",
    "long_term": "贞观之治成为后世治理典范。但依赖个人而非制度的极限也显现：魏征一死，纳谏质量滑坡，征高丽之失、晚年渐恶直言（曾因谗毁推倒魏征墓碑，辽东败后复立）——说明「听真话」的机制若系于一人一君之贤，不可持续。"
  },
  "original_text": [
    { "quote": "上曰：「人以铜为镜，可以正衣冠；以古为镜，可以见兴替；以人为镜，可以知得失。魏徵没，朕亡一镜矣！」", "citation": "资治通鉴·卷一百九十六·唐纪十二" },
    { "quote": "上尝罢朝，怒曰：「会须杀此田舍翁！」后问为谁，上曰：「魏徵每廷辱我。」后退，具朝服立于庭……曰：「妾闻主明臣直；今魏徵直，由陛下之明故也，妾敢不贺！」上乃悦。", "citation": "资治通鉴·卷一百九十四·唐纪十（据《隋唐嘉话》等，通鉴系年略异，用前请核对）" },
    { "quote": "征曰：「先太子早从征言，必无今日之祸。」上素重其才，改容礼之，引为詹事主簿。", "citation": "资治通鉴·卷一百九十一·唐纪七" }
  ],
  "insight": [
    "决策者听到的信息质量由「上一个说真话的人的下场」决定；处理直言者的每个动作都是对全组织的公开定价。",
    "招降敌营直臣的逆向逻辑：对旧主尽忠敢言的人，恰是最值得信的人——投诚时痛骂旧主者才最危险。",
    "真话通道需要冗余设计（谏官制度+皇后缓冲+史官监督），单靠决策者个人雅量不可持续——魏征死后的滑坡是制度化失败的证明。",
    "决策者的自我约束：太宗知道「人人知上意」的危险，主动为反对意见付溢价。现代对应：老板必须为坏消息设正向激励，否则只会最后一个知道坏消息。"
  ],
  "risks": [
    "「纳谏」不等于「谁声音大听谁的」；魏征的谏有质量门槛（引经据典、给方案）。鼓励直言与决策权分离，最终裁断责任仍在决策者。",
    "此案是从掌权者视角写的；若你是「魏征」的位置，需先评估你的「太宗」是否真有纳谏的记录——对着李斯时代的秦二世学魏征，是送命题。",
    "太宗晚年推倒魏征墓碑的插曲提醒：君主的雅量有周期，直臣的安全边际会随权力者心境漂移，勿把某一时期的宽容当作永久契约。"
  ],
  "modern_scenarios": ["创始人如何对待总唱反调的高管", "要不要重用竞争对手的旧部", "组织里坏消息传不上来怎么办"],
  "paired_cases": ["tongjian-feishui-fujian", "shiji-zhouyafu-end"],
  "keywords": ["纳谏", "真话", "唱反调", "信息通道", "坏消息", "直言", "旧部", "雅量", "一言堂", "反馈"]
}
