{
  "id": "tongjian-mayuan-zejun",
  "title": "马援择君：「臣亦择君」",
  "actors": ["马援", "刘秀", "公孙述", "隗嚣"],
  "era": "东汉建武四年（28）",
  "source": { "book": "资治通鉴", "chapter": "卷四十一·汉纪三十三" },
  "kernel": ["站队择主", "用人识人"],
  "situation": "新莽末天下反覆，「盗名字者不可胜数」：隗嚣据陇右（马援为其所重，奉使往来）、公孙述称帝于蜀、刘秀定河北。建武四年，隗嚣先派马援入蜀观察公孙述，再遣他奉书洛阳觐见刘秀。马援手里握着三个可选落点：老东家隗嚣、同县故友公孙述（许封侯拜大将）、以及素未谋面的刘秀。这是一次为自己后半生定价的双向面试——而且他是去「面」两位「老板」的候选人。",
  "options": [
    { "option": "留蜀事公孙述：同县故交+高规格礼遇+侯爵大将的许诺", "assessment": "待遇最厚、礼数最全；但陛戟而后进的排场暴露的是政权的防御性自我怀疑——连故友来使都要武装隔离。" },
    { "option": "归隗嚣：老东家，恩旧深厚", "assessment": "情义与惯性；但隗嚣首鼠两端、陇右四战之地，跟着谁赢都看不清——而且马援此行正是替他做尽调。" },
    { "option": "事汉从刘秀：无仪式、无许诺，只有便殿闲坐迎笑", "assessment": "账面最寒酸；但松弛与从容是自信的生理信号——一个敢不设防见「刺客嫌疑者」的人，政权质地完全不同。" }
  ],
  "choice": "在蜀，公孙述「盛陈陛卫以延援入，交拜礼毕，使出就馆」——盛大仪仗、完备礼节，然后送客。在洛阳，「帝在宣德殿南庑下，但帻，坐，迎笑」——头巾便装，起身笑着迎他，开口竟是自嘲：「卿遨游二帝间；今见卿，使人大惭。」马援顿首辞谢，随即亮出那句名言：「当今之世，非但君择臣，臣亦择君矣！」还反将一军：陛下怎么知道我不是刺客奸人？帝复笑曰：「卿非刺客，顾说客耳。」归来后，马援力劝隗嚣归汉；隗嚣首鼠终叛，马援没有跟随旧主赴死，而是上书请正其罪、坚定站到汉一侧——后来成为光武的伏波将军。",
  "reasoning": "马援的择主方法论：①看「真质地」不看「接待规格」——公孙述的陛戟仪卫是防御性表演，礼仪越森严说明安全感越低；刘秀的便帻迎笑是松弛的自然流露，排场与自信成反比；②「卿遨游二帝间，使人大惭」这句自嘲是最贵的信号：君主能拿使者的两面性开玩笑，说明心理带宽与政权容错都充足；③他当场做了一次反向测试——「何知非刺客奸人」，刘秀以玩笑接住而非色变，应变模式过关；④「臣亦择君」宣示的是市场观：把自己当资产的人才敢谈双向选择——选择权的来源是你真的有替代选项，且敢让对手知道；⑤对旧主隗嚣，他先尽义务（劝归、复命）再择新主，程序正当，所以最终与嚣决裂时无人能指其背义。",
  "outcome": {
    "short_term": "隗嚣拒谏终叛；马援坚定归汉阵营，随军击嚣。",
    "long_term": "拜伏波将军，南平交趾，封新息侯；六十二岁仍请缨征五溪，卒于军。身后一度被梁松等构陷、追收侯印——择对了主不等于终身安全，此为下一课（功高震主）；建初三年冤案平反。「马革裹尸」与「臣亦择君」共同构成他的一生注脚。"
  },
  "original_text": [
    { "quote": "帝在宣德殿南庑下，但帻，坐，迎笑，谓援曰：「卿遨游二帝间；今见卿，使人大惭。」援顿首辞谢，因曰：「当今之世，非但君择臣，臣亦择君矣！臣与公孙述同县，少相善；臣前至蜀，述陛戟而后进臣。」", "citation": "资治通鉴·卷四十一·汉纪三十三" },
    { "quote": "嚣乃使援奉书雒阳。……隗嚣使马援往观公孙述。援素与述同里闬，相善，以为既至，当握手欢如平生；而述盛陈陛卫以延援入，交拜礼毕，使出就馆。", "citation": "资治通鉴·卷四十一·汉纪三十三" }
  ],
  "insight": [
    "择主的三重观察：接待规格是表演层，反应模式是试探层（抛一个尖锐问题看接法），大度容量是底牌层（能否自嘲、能否容纳「你可能走」的假设）。",
    "「非但君择臣，臣亦择君」：把自己当资产的人才有选择权。没有替代选项时，先攒选项再谈忠诚——忠诚是选择之后的立场，不是没有选择时的借口。",
    "礼仪是防御，松弛是自信：一个组织创始人的真实质地，往往在「不设防的细节」里——接见场合的拘谨程度，常常与政权/公司的内在安全感成反比。",
    "换主的程序正义：先尽旧主之义（复命、劝谏），再择新木而栖——程序干净，决裂才不背骂名。"
  ],
  "risks": [
    "别被「高薪高礼遇」的全套排场绑架：述模式（给钱、给头衔、防着你）在今天的对应是开出大包大揽的 offer 却处处设防的公司——入职前看团队的松弛度与创始人的带宽。",
    "马援的结局同时是警示：择对了主，身后仍被构陷夺印。择主解决「跟谁」，解决不了「功高震主」——两条线要分开管理。",
    "「臣亦择君」的表达需要本钱：说出这句话的前提是你有真实且可见的替代选项；没有筹码时的豪言叫要挟，会直接出局。"
  ],
  "modern_scenarios": ["手里同时有几个 offer/合作方，怎么选", "跳槽看排场还是看质地", "老东家与新平台之间的程序正义", "如何观察一个老板的真实质地"],
  "paired_cases": ["shiji-chenping-guihan", "tongjian-chibi-zhanhe", "shiji-zhouyafu-end"],
  "keywords": ["跳槽", "择主", "选老板", "offer", "面试", "双向选择", "站队", "跟对人", "平台质地", "创始人", "归汉", "背书"]
}
