{
  "id": "tongjian-xuanwumen",
  "title": "玄武门前夜：等死、外放，还是先发制人",
  "actors": ["李世民", "李建成", "李元吉", "长孙无忌", "房玄龄", "杜如晦", "尉迟敬德"],
  "era": "唐初",
  "source": { "book": "资治通鉴", "chapter": "卷一百九十一·唐纪七" },
  "kernel": ["关键决断"],
  "situation": "武德九年，秦王李世民功盖天下（平薛举、刘武周、王世充、窦建德），与太子建成的冲突已不可调和且进入执行阶段：其核心幕僚房玄龄、杜如晦被驱逐出府，大将尉迟敬德遭收买不成后被下狱几死，程知节被外调。突厥入寇，建成荐元吉督军北征，「取秦王帐下精兵，夺其兵权」，并密谋在昆明池饯行时杀之——率更丞王晊将此密报李世民。窗口：数日。",
  "options": [
    { "option": "静观待变，寄望父皇裁断或兄弟转圜", "assessment": "道德上最安全；但对方屠刀已举（昆明池之谋），己方爪牙已被逐步拆解，再等即束手就擒。幕僚断言：「大王临机不断……祸至而不恐，虽存亡之际，何以自安？」" },
    { "option": "出走洛阳，据山东以抗", "assessment": "曾被考虑（「建成、元吉恐世民据洛阳」而止之）；割据等于公开内战，胜负未知且背分裂之名。" },
    { "option": "先发制人，伏兵玄武门诛建成、元吉", "assessment": "背负杀兄逼父的永久道德负债；但一击可定，且己方握有玄武门守将（常何）等隐性布局。" }
  ],
  "choice": "李世民在幕僚集体逼谏（长孙无忌、尉迟敬德以去留相胁）与占卜被张公谨掷龟打断（「卜以决疑，不疑何卜！」）之后定策：六月四日伏兵玄武门，亲射建成，尉迟敬德杀元吉，随后控制高祖，三日后立为太子，八月受禅。",
  "reasoning": "决策结构：①这已不是「做不做」而是「谁先做」的问题——对方的加害路线（夺兵权→支开将领→昆明池设伏）已在执行，等待的期望值是确定的死亡；②道德成本无法消除但可事后用治理成绩部分偿还，而肉体消灭不可逆转；③其犹豫主要是名分成本（「骨肉相残，古今大恶」），幕僚的作用是把「不行动的后果」具象化，斩断用占卜拖延的心理逃避。",
  "outcome": {
    "short_term": "建成、元吉死，诸子被诛除属籍；高祖立世民为太子，「军国庶事，无大小悉委太子处决」。",
    "long_term": "即位为唐太宗，开贞观之治，纳谏用贤，成为后世帝范；但玄武门的道德负债终身随行——史官直书其事，太宗晚年数次索观起居注，且诸子夺嫡相残，被认为是玄武门示范效应的回响。"
  },
  "original_text": [
    { "quote": "率更丞王晊密告世民曰：「太子语齐王：『今汝得秦王骁将精兵……当与秦王饯别于昆明池，使壮士拉杀之于幕下。』」", "citation": "资治通鉴·卷一百九十一·唐纪七" },
    { "quote": "张公谨自外来，取龟投地，曰：「卜以决疑；今事在不疑，尚何卜乎！卜而不吉，庸得已乎！」于是定计。", "citation": "资治通鉴·卷一百九十一·唐纪七" },
    { "quote": "六月庚申，世民帅长孙无忌等入，伏兵于玄武门……世民射建成，杀之；尉迟敬德将七十骑继至……杀元吉。", "citation": "资治通鉴·卷一百九十一·唐纪七" }
  ],
  "insight": [
    "判断「摊牌时机」的核心不是自己准备好没有，而是对方是否已进入执行阶段：拆你团队、夺你资源、设局支开——加害路线图可被观察。",
    "「临机不断」的心理机制是用程序性动作（占卜/再等等/再问问）逃避决断；张公谨掷龟点破：信息已足时，继续收集信息就是怯懦的变体。",
    "重大决断前压力测试来自核心团队的用脚投票（无忌等以离去相胁）——当最忠诚的人开始给你下最后通牒，说明窗口真的在关闭。",
    "道德负债是真实成本：李世民用了一生的善治来对冲杀兄之名，且家族内部代价（诸子相残）滞后爆发。算总账时要把这类长尾负债计入。"
  ],
  "risks": [
    "此案的现代映射必须严格降维：适用于「对方已在执行排挤/夺权路线时，抢先公开摊牌、诉诸董事会/法律」，绝不适用于任何非法手段。",
    "「先发制人」正当性的前提是加害证据确凿（王晊密报+一系列可见动作）；仅凭猜忌先动手，就成了迫害者。",
    "李世民的成功依赖多年积累的班底与玄武门布局；无实力储备的先发制人只是加速自爆。",
    "警惕自我合理化：把「我想夺权」包装成「我被迫自卫」是此类叙事的常见陷阱，史书亦有为胜者讳的成分。"
  ],
  "modern_scenarios": ["合伙人已在架空你（改架构、挖你的人、支开你）是否立即摊牌", "董事会斗争中先手发难还是等待", "竞争条线要吞并你的团队"],
  "paired_cases": ["shiji-hongmen"],
  "keywords": ["摊牌", "先发制人", "内斗", "架空", "夺权", "犹豫", "窗口", "董事会", "合伙人", "决断"]
}
