{
  "id": "tongjian-cao-yingtianzi",
  "title": "曹操迎天子：唯一一次的「抄底汉室」",
  "actors": ["曹操", "荀彧", "汉献帝", "袁绍"],
  "era": "东汉建安元年（196）",
  "source": { "book": "资治通鉴", "chapter": "卷六十二·汉纪五十四" },
  "kernel": ["关键决断", "站队择主"],
  "situation": "董卓之乱后，汉献帝东逃，颠沛至洛阳——「东京榛芜」，宫室烧尽，百官采稆自随，天子形同流民。天下割据者的态度出奇一致：谁都知道天子有价值，谁都不想接这个烫手山芋。袁绍的谋士劝他迎驾，绍不从（郭图、淳于琼反对：「汉室陵迟，为日久矣，今欲兴之，不亦难乎」）；袁术干脆自己想当皇帝。曹操在许县，谋迎天子——内部同样有反对意见。",
  "options": [
    { "option": "不迎——「山东未定，韩暹、杨奉负功恣睢，未可卒制」", "assessment": "多数幕僚的判断：根据地未稳，献帝身边还有董承、韩暹、杨奉各路军头，接驾等于引火烧身；且「挟天子」名声难听，可能丧失盟友。" },
    { "option": "与袁绍等共同尊奉、分享挟持权", "assessment": "风险分摊；但王牌从此多人持有，等于没有王牌——袁绍的路线已被证明是死路。" },
    { "option": "独力迎驾，迁都于许", "assessment": "把汉室的「正统期权」全部收入囊中：以最小的军事成本获得对全体诸侯的政治优势——代价是与「忠汉」舆论的长期绑定及未来的道德包袱。" }
  ],
  "choice": "荀彧给出本库最著名的战略论述之一：「昔晋文公纳周襄王而诸侯景从，汉高祖为义帝缟素而天下归心。自天子蒙尘，将军首唱义兵，徒以山东扰乱，未遑远赴。今銮驾旋轸，东京榛芜，义士有存本之思，兆民怀感旧之哀。诚因此时，奉主上以从人望，大顺也；乘至公以服天下，大略也；扶弘义以致英俊，大德也。四方虽有逆节，其何能为？韩暹、杨奉，安足恤哉！若不时定，使豪杰生心，后虽为虑，亦无及矣。」曹操采纳，亲至洛阳奉迎天子，迁都于许。天子拜操大将军。此后「奉天子以令不臣」：屯田足食，人才辐辏——袁绍后悔时，请求把天子迁到鄄城靠近自己，被曹操拒绝；田丰劝绍「早图许」，绍不听。",
  "reasoning": "①荀彧的三重收益结构（大顺、大略、大德）把「接盘」翻译成了「抄底」：天子蒙尘=正统资产的历史最低点，接驾成本（军事风险）远低于其期权价值（对诸侯的合法性优势、对人才的号召力）；②窗口的唯一性：「若不时定，使豪杰生心，后虽为虑，亦无及矣」——正统资产的定价会随时间衰减（等豪杰们各自做大，汉室连筹码都算不上）；③对手的错误是他方送来的：袁绍想「立刘虞」不成又拒绝迎驾、袁术忙于称帝——两大诸侯在同一个资产上的集体看空，正是曹操的做多窗口；④风险对冲设计：迁都于许（在自己地盘）、以大将军之位安抚、屯田解决供养——把「最高负债资产」变成可持续运营的资产，而非纯成本中心。⑤远期注脚：这道期权后来变成道德负债——荀彧晚年因反对曹操称魏公而忧郁而终（一说赐死），「奉天子」的初心与「代汉」的终局之间，站着荀彧的尸体。",
  "outcome": {
    "short_term": "迎驾成功，迁都许县；曹操取得「以令不臣」的战略地位，人才（含荀攸、郭嘉）与粮秣（屯田）双入。",
    "long_term": "官渡之战的政治基础由此奠定（袁绍「名不正」）；曹操终其一生未称帝——不是不想，是这道期权的行使条款就是「终身不得称帝」：他吃到红利，也付了终身利率。"
  },
  "original_text": [
    { "quote": "彧曰：「昔晋文公纳周襄王而诸侯景从，汉高祖为义帝缟素而天下归心。……诚因此时，奉主上以从人望，大顺也；乘至公以服天下，大略也；扶弘义以致英俊，大德也。四方虽有逆节，其何能为？韩暹、杨奉，安足恤哉！若不时定，使豪杰生心，后虽为虑，亦无及矣。」", "citation": "资治通鉴·卷六十二·汉纪五十四" },
    { "quote": "众以为「山东未定，韩暹、杨奉负功恣睢，未可卒制。」……操遂至洛阳，奉迎天子都许。", "citation": "资治通鉴·卷六十二·汉纪五十四" }
  ],
  "insight": [
    "共识性看空的资产才有抄底窗口：人人都知道有价值、人人都嫌烫手的选项（正统、牌照、核心技术团队），其价格恰在最低点——对手的集体回避就是你的入场券。",
    "战略期权有时效：「后虽为虑，亦无及矣」——合法性、窗口期、先发身位这类资产的定价随时间快速衰减，犹豫的成本不是不变，是指数上升。",
    "接盘之前先设计「可持续运营」：曹操把天子迁到自己的地盘、用屯田解决供养、用官爵理顺关系——高风险资产的接收者必须同时是运营者，否则接来的不是期权是包袱。",
    "期权的行使条款要看清：奉天子的红利以「终身不得称帝」为隐性对价——每份战略资产都有它的隐藏负债，签字前想清楚你愿不愿意付终身利率。"
  ],
  "risks": [
    "「挟天子」的现代对应（控股平台、独家牌照、标准制定权）有真实的合规边界：以胁迫方式获取的「正统性」在现代是反垄断与公司法风险——学的是估值眼光，不是绑架手法。",
    "抄底的前提是运营能力：没有屯田（现金流）与许都（控制力）的迎驾，就是第二个被拖垮的杨奉。评估自己是否「接得住」，比评估资产是否便宜更重要。",
    "荀彧之死是本案例的另一半：当初为你论证期权的首席智囊，最后可能死于期权条款本身——战略转向时，第一批受损的往往是当初的论证者，善待他们是组织良知的底线。"
  ],
  "modern_scenarios": ["要不要接手别人都不要的业务/牌照/团队", "战略窗口期的估值判断", "接盘后的运营整合", "与「初心」绑定的长期对价"],
  "paired_cases": ["tongjian-xuanwumen", "shiji-lvbuwei-qihuo", "shiji-chenping-guihan"],
  "keywords": ["战略窗口", "抄底", "正统性", "奉天子", "先发优势", "期权", "决策", "袁绍", "迎驾", "合法性", "窗口期", "接盘"]
}
