{
  "id": "shiji-hongmen",
  "title": "鸿门宴：对手已在刀俎之上，杀还是放",
  "actors": ["项羽", "范增", "刘邦"],
  "era": "秦末",
  "source": { "book": "史记", "chapter": "项羽本纪" },
  "kernel": ["关键决断"],
  "situation": "项羽拥兵四十万驻鸿门，刘邦十万驻霸上，实力悬殊。曹无伤告密刘邦「欲王关中」，范增力主击杀：「此其志不在小……急击勿失。」刘邦次日亲赴鸿门谢罪，自投罗网。消灭最大潜在对手的成本此刻最低——只需席间一声令下。窗口以小时计。",
  "options": [
    { "option": "依范增之谋，席间杀刘邦", "assessment": "背负杀降般的恶名、可能震动其他诸侯；但一劳永逸移除唯一有实力争天下的对手。" },
    { "option": "放刘邦归，日后以势压之", "assessment": "保全「义」的名声，维持霸主体面；但给对手留下翻盘的全部可能。刘邦已表现出极强的隐忍与应变力。" },
    { "option": "扣留刘邦，夺其军而不杀", "assessment": "折中方案，席间可行；项羽未认真考虑。" }
  ],
  "choice": "项羽接受刘邦谢罪，「项王默然不应」范增的多次示意（举玦者三），项庄舞剑又被项伯掩护，最终放刘邦逃归霸上。",
  "reasoning": "项羽的判断依据：其一，刘邦已当面臣服，杀之「不义」，损害自己贵族式的名誉自期；其二，自恃实力绝对优势，认为刘邦翻不了盘，不值得付名誉成本；其三，叔父项伯受了张良人情连夜说项，改变了他的初始意图。本质是用「当下的体面」为「未来的风险」定了极低的价。",
  "outcome": {
    "short_term": "刘邦脱身，诛杀告密的曹无伤，君臣自此深备项羽。范增怒言：「唉！竖子不足与谋。夺项王天下者，必沛公也。吾属今为之虏矣！」",
    "long_term": "四年后垓下之围，项羽自刎乌江，天下归刘邦——范增的预言逐字兑现。"
  },
  "original_text": [
    { "quote": "范增数目项王，举所佩玉玦以示之者三，项王默然不应。", "citation": "史记·项羽本纪" },
    { "quote": "亚父受玉斗，置之地，拔剑撞而破之，曰：「唉！竖子不足与谋。夺项王天下者，必沛公也。吾属今为之虏矣！」", "citation": "史记·项羽本纪" },
    { "quote": "范增说项羽曰：「沛公居山东时，贪于财货，好美姬。今入关，财物无所取，妇女无所幸，此其志不在小……急击勿失。」", "citation": "史记·项羽本纪" }
  ],
  "insight": [
    "识别对手的正确方法是范增式的：看行为的变化（入关后一反常态地不取财货），而不是听对方此刻说什么（刘邦的当面谢罪）。",
    "绝对优势期是处理根本性威胁成本最低的时刻；「以后再说」意味着以后用十倍成本处理。",
    "决断时刻的「心软/体面」往往不是善良，而是用别人看得见的姿态成本，回避自己看不见的未来成本。",
    "身边人的立场会污染决策：项伯一夜之间改变了项羽的初始意图，重大决断前要审查「谁在最后时刻影响了我，他的利益是什么」。"
  ],
  "risks": [
    "此案不可直译为「对竞争对手要赶尽杀绝」——现代商业是重复博弈且有法律边界，斩尽杀绝式打法常招致反噬。真正可迁移的是「根本性风险要在成本最低的窗口处理，而非无限延后」。",
    "刘邦的翻盘也依赖巨大的运气与项羽后续一连串失误；不要由单一案例得出「放过对手必败」的确定结论。",
    "警惕反向过度：把所有竞争者都当成「必除的刘邦」，会把可合作方推向对立。"
  ],
  "modern_scenarios": ["核心员工要出走创业做同类产品，是否立刻处理竞业", "有机会低价收购潜在颠覆者，犹豫成本高", "谈判桌上对手示弱求和，接不接受"],
  "paired_cases": ["tongjian-xuanwumen"],
  "keywords": ["犹豫", "心软", "斩草除根", "竞争对手", "机会窗口", "妇人之仁", "当断不断", "养虎为患", "面子", "决断"]
}
