{
  "id": "tongjian-xiaowendi-qianlu",
  "title": "孝文帝迁都：借一场「南征」完成的改革",
  "actors": ["北魏孝文帝", "任城王拓跋澄", "鲜卑贵族"],
  "era": "北魏太和十七年（493）",
  "source": { "book": "资治通鉴", "chapter": "卷一百四十·齐纪六" },
  "kernel": ["变革树敌", "关键决断"],
  "situation": "孝文帝拓跋宏要办的事：把都城从平城迁到洛阳，全面汉化。真实动机：平城是用武之地，「非可文治，移风易俗，信为甚难」，且鲜卑保守贵族盘踞，任何「迁都」议题都会在朝堂上被立即绞杀。通鉴记下了他的处境与对策：「魏主以平城地寒，六月雨雪，风沙常起，将迁都洛阳；恐群臣不从，乃议大举伐齐，欲以胁众。」——把迁都包装成南征，让反对者无从集结。",
  "options": [
    { "option": "公开提案，走廷议程序", "assessment": "程序正当；但「迁都=弃祖宗之基」的帽子扣下来，廷议之日就是提案死亡之日。" },
    { "option": "先做通少数重臣，再小范围推动", "assessment": "可以拉到任城王等盟友；但鲜卑贵戚的整体反弹仍在，迁都是数万人的物理迁移，糊弄不过中下层。" },
    { "option": "以战争名义裹挟（实际选择）", "assessment": "南伐是政治正确：祖宗以武立国，谁反对南征谁就是反对国策；大军行至洛阳，暴雨连绵、群臣疲敝，此时才亮出真实选项——迁都，或者继续冒雨南征送死。" }
  ],
  "choice": "出发前，孝文帝在明堂搞了一次预演：让太常卿王谌占卦，得「革」卦，他厉声宣布：「此是汤武革命，顺天应人之卦也！」任城王拓跋澄当场质疑，孝文帝勃然作色：「社稷我社稷，任城而欲沮众也！」——但当澄退下后单独求见，孝文帝却摊牌了真实意图，把汉化大计和盘托出；澄转为坚定盟友，孝文帝大喜：「任城便是我之子房。」大军南下，至洛阳，连日大雨，群臣泣谏止伐；孝文帝亮出底牌：「若不南征，便当迁都于此。」并给 dissenters 一次「形式选择」：欲迁者立于左，不愿者立于右——在「冒雨伐齐送死」与「迁都洛阳」之间，众人默契地站到了左边。迁都既成，汉化改革（改汉姓、禁胡语、定族姓）次第展开。",
  "reasoning": "①议题置换的机制：直接提迁都，反对联盟会在第一会议就集结成形；借「南征」，他让所有人先上了车——等暴露真实选项时，退出成本（抗旨、军法、政治生命）已经压过反对收益；②占卦与发怒都是导演动作：「革」卦给天意，「社稷我社稷」立权威——一套面向围观者的确定性输出；③真正的联盟工作在私下完成：任城王拓跋澄被单独说服（并授予「子房」的角色期待），成为改革在宗室内的锚点；④形式选择权的精妙：让群臣「选」迁都——被动的服从变成主动的站队，日后无人能说自己被胁迫（这正是帝王之术的高明与可憎之处）；⑤代价清单同样真实：太子恂谋北归被废赐死、穆泰等叛乱、鲜卑六镇军人被制度性边缘化——三十年后六镇之乱倾覆北魏，种子在此埋下。",
  "outcome": {
    "short_term": "迁都洛阳完成；改籍贯、禁胡服胡语、定姓族——一场自上而下的全盘汉化在数年内推行。",
    "long_term": "北魏文化整合空前成功：洛阳成为北方文明中心，胡汉融合的制度基础奠定（隋唐的统一在此发育）；但军事重心（六镇）与政治重心（洛阳）的结构断裂，最终以六镇之乱引爆，北魏分裂。改革的遗产与账单，由不同的后代分别继承。"
  },
  "original_text": [
    { "quote": "魏主以平城地寒，六月雨雪，风沙常起，将迁都洛阳；恐群臣不从，乃议大举伐齐，欲以胁众。", "citation": "资治通鉴·卷一百四十·齐纪六" },
    { "quote": "帝曰：「今日之行，诚知不易。但国家兴自北土，徙居平城，虽富有四海，文轨未一，此间用武之地，非可文治，移风易俗，信为甚难。崤函帝宅，河洛王里，因兹大举，光宅中原，任城意以为何如？」……曰：「任城便是我之子房。」", "citation": "资治通鉴·卷一百四十·齐纪六" }
  ],
  "insight": [
    "当反对者会在正式议程上集结时，就把议题藏进一个更大的共识里：借「南征」上车、到站再换车——不可逆点提前设置，是改革者对抗否决政治的核心技术。",
    "公开议程演权威，私下渠道做联盟：明堂的雷霆之怒与内殿的坦诚相告是同一场戏的两幕——面向围观者的确定性输出，与面向盟友的利益绑定，缺一不可。",
    "给人「形式选择权」是被胁迫者最后的人性设计，也是决策者最该警惕的自我欺骗：当选项清单里只有「送死」与「服从」时，选出来的「同意」没有合法性。",
    "评估改革要看它把谁边缘化了：六镇的怨恨被推迟三十年兑付——任何把结构性风险转嫁给某个群体的变革，都在为未来的爆炸攒弹药。"
  ],
  "risks": [
    "议题置换在商业世界的合法边界：真实意图与表面议程的落差如果涉及欺诈性陈述（对投资人、对员工），在现代语境下有法律责任与信任崩塌风险——可借鉴的是「不可逆点前置」，不是欺骗。",
    "「形式选择」的现代翻版（被辞职式谈判、全票通过式表决）会损耗组织的长期信任：把胁迫包装成自愿，一次有效，两次透支。",
    "变革的账单追踪：孝文帝式的全盘改造，胜在文化、败在结构（六镇）——现代转型同样需要一张「被牺牲者清单」并为其设计补偿机制，否则爆雷只是时差问题。"
  ],
  "modern_scenarios": ["重大转型如何穿越否决政治", "先斩后奏式的组织变革", "变革中的联盟搭建", "被改革边缘化群体的风险"],
  "paired_cases": ["shiji-zhaowuling-hufu", "tongjian-chuocuo-xiaofan", "shiji-shangyang-zhaoliang"],
  "keywords": ["迁都", "改革", "变法", "议题设置", "汉化", "先上车后补票", "不可逆", "否决政治", "联盟", "形式选择", "孝文帝", "六镇"]
}
