{
  "id": "shiji-xiaohe-zhuixin",
  "title": "萧何追韩信：「国士无双」的识人豪赌",
  "actors": ["萧何", "韩信", "刘邦"],
  "era": "秦末汉初",
  "source": { "book": "史记", "chapter": "淮阴侯列传" },
  "kernel": ["用人识人", "高风险押注"],
  "situation": "汉元年，刘邦入蜀。韩信亡楚归汉，仍无名：为连敖（管粮饷的小吏）坐法当斩，滕公救之，言于上，拜治粟都尉，「上未之奇也」——连萧何举荐过的简历都没引起刘邦兴趣。至南郑，将士逃亡数十人；韩信自度萧何虽多次举荐、终不见用，也逃了。萧何闻讯，「不及以闻，自追之」——来不及向刘邦报告，自己就追出去了。有人报告刘邦：丞相萧何逃了。上大怒，如失左右手。",
  "options": [
    { "option": "不追——一个逃亡的粮饷小吏，损失可计", "assessment": "程序理性；但若韩信真是「国士」，损失的是天下。" },
    { "option": "追回来，让刘邦按正常流程考察", "assessment": "程序稳妥；但正常流程正是韩信离开的原因——再走一遍流程=再丢一次。" },
    { "option": "追回 + 以宰相全部信用担保 + 要求择良日斋戒设坛拜大将", "assessment": "把「看走眼」的风险全押在自己名声上；同时给这次任命设计一场无法降格的仪式。" }
  ],
  "choice": "一二日后萧何回来谒见，刘邦且怒且喜骂道：「若亡，何也？」何曰：「臣不敢亡也，臣追亡者。」上曰：「若所追者谁？」曰：「韩信也。」上复骂曰：「诸将亡者以十数，公无所追；追信，诈也。」何曰：「诸将易得耳。至如信者，国士无双。王必欲长王汉中，无所事信；必欲争天下，非信无所与计事者。」刘邦说那就让他做个将军，何曰：「虽为将，信必不留。」刘邦说那就拜大将，何曰：「幸甚。」刘邦要召韩信直接来拜，何拦住：「王素慢无礼，今拜大将如呼小儿耳，此乃信所以去也。王必欲拜之，择良日，斋戒，设坛场，具礼，乃可耳。」刘邦许之。拜将之日，「一军皆惊」。",
  "reasoning": "萧何的识人机制可拆成四层：①认知校验靠长对话——「信数与萧何语，何奇之」：他不用简历判断人，用多轮深谈校验对方的认知结构；②把「离职行为」当估值信号：一个被历史证明为国士的人主动离开，说明组织定价错误——人才用脚投票本身就是尽调报告；③拒绝谈判中的降格方案（「虽为将，信必不留」）：他知道人才留不留取决于角色与预期的匹配，不取决于头衔的小幅升级；④修复组织的用人缺陷本身：韩信此前差点被斩、被忽视，根因是「王素慢无礼」——所以拜将必须设坛场具礼，仪式不是给韩信的面子，是对全组织发布「我们尊重这种人」的信号。萧何同时完成了估值、担保与入职设计三件事。",
  "outcome": {
    "short_term": "登坛拜将，一军皆惊；韩信策动明修栈道暗度陈仓，还定三秦。",
    "long_term": "韩信助定天下（破魏、代、赵、燕、齐，会歼项羽于垓下）；萧何识人之名千古。但同一萧何后来又把韩信骗进长乐宫钟室（对照「蒯通说韩信」「萧何自污」两案）——识人与忠君是两套系统，萧何两套都赢了，韩信两套都输了。"
  },
  "original_text": [
    { "quote": "何曰：「诸将易得耳。至如信者，国士无双。王必欲长王汉中，无所事信；必欲争天下，非信无所与计事者。顾王策安所决耳。」", "citation": "史记·淮阴侯列传" },
    { "quote": "何曰：「王素慢无礼，今拜大将如呼小儿耳，此乃信所以去也。王必欲拜之，择良日，斋戒，设坛场，具礼，乃可耳。」王许之。诸将皆喜，人人各自以为得大将，乃韩信也，一军皆惊。", "citation": "史记·淮阴侯列传" }
  ],
  "insight": [
    "识人的第一信号源是行为而非履历：多轮长对话校验认知结构，「主动离职」这种行为数据比任何推荐信都诚实——被组织低估的人正在流失，是估值错误最响的警报。",
    "担保的本质是用自己的信用给认知下注：萧何赌上相位担保一个仓管小吏，说明识人体系的尽头是敢不敢把身家押上去——不敢下注的识人只是围观。",
    "留住顶级人才靠角色与仪式，不靠头衔加半级： 「将军」留不住「大将」的人；而拜将仪式的成本极低、信号价值极高——它向整个组织宣布了人才的标准。",
    "用人错误的最大来源常是组织的坏习惯（「素慢无礼」）：修复人才流失，往往要先修复决策者的行为模式。"
  ],
  "risks": [
    "担保是双刃剑：萧何的「国士无双」让韩信起飞，但担保同时也屏蔽了组织对韩信的独立审查（请立假齐王、要挟封地皆与此有关）。担保人要对被担保人的「后续行为」保留追责通道，而非无限背书。",
    "反向案例就在本库：长平之战的担保链（「赵括善言兵」）错在哪？——错在校验手段（言谈）与岗位要求（实战）不匹配。萧何谈的是战略认知，岗位恰好是战略执行；若无此匹配，长谈也会看走眼。",
    "「一军皆惊」的另一面：超擢必引发老员工反弹，萧何用「择良日、斋戒、具礼」的隆重感把任命做成了制度事件而非个人偏好——现代组织越擢人才，越需要把流程与理由摊在阳光下。"
  ],
  "modern_scenarios": ["核心人才提离职，拦不拦、怎么拦", "内部被低估的人才识别", "为关键人才设计入职/晋升仪式", "用人担保的责任边界"],
  "paired_cases": ["shiji-changping-huanjiang", "tongjian-taizong-yongren", "shiji-hanxin-kuaice"],
  "keywords": ["识人", "招聘", "核心人才", "国士无双", "离职", "入职设计", "越级提拔", "担保", "信号", "人才盘点", "拦人", "大将"]
}
