{
  "id": "tongjian-hanxin-kuaxia",
  "title": "胯下之辱（通鉴版）：一个被骂到钻裤裆的人，凭什么做全军大将",
  "actors": ["韩信", "淮阴屠中少年", "萧何", "刘邦"],
  "era": "秦末（汉高帝元年前夕）",
  "source": { "book": "资治通鉴", "chapter": "卷九·汉纪一" },
  "kernel": ["忍辱蓄势", "用人识人"],
  "situation": "通鉴卷九在韩信出场时，用了两百字写他的底层处境：家贫、无行、不得推择为吏、不能治生商贾，「常从人寄食饮，人多厌之」——寄食漂母被嫌、被南昌亭长妻逐出，是那个时代最底层的「失败者样本」。然后是那个著名场面：淮阴屠户少年当众挑衅：「若虽长大，好带刀剑，中情怯耳」「信能死，刺我；不能死，出我袴下！」——围观全市场的人都在等一个结果：杀人，或者钻裆。司马光把这段屈辱史放在韩信登坛拜将之前，作为理解这个人后来一切的钥匙。",
  "options": [
    { "option": "拔剑刺之", "assessment": "尊严即时兑付；此后两条路：偿命（法律账）或亡命（人生账）——无论如何，「韩信」这个名字到此为止。" },
    { "option": "钻裆，被全市场嘲笑", "assessment": "当下人格折旧到地板；但保留了这个人的「期权」——未来的每一场战役都在为这次定价翻案。" },
    { "option": "转身离开，不接战也不钻裆", "assessment": "看似体面的中间态；但在围观政治里，「逃走」与「钻裆」的羞辱等价，却没有「蒲伏」的戏剧性来承载日后的翻转叙事——历史的注意力不会记住中间态。" }
  ],
  "choice": "「于是信孰视之，俛出袴下，蒲伏。一市人皆笑信，以为怯。」——注意那个被多数人忽略的细节：「孰视之」。韩信盯着对方看了很久才趴下去：这不是吓瘫，是完成了一次完整的利弊计算后的执行。多年后他以楚王之身重返淮阴，找到当年那个少年，封他为楚中尉，并告诉诸将：「此壮士也。方辱我时，我宁不能杀之邪？杀之无名，故忍而就于此。」——我不杀你不是不敢，是杀你换不来任何东西，而忍下来，换来了今天的一切。",
  "reasoning": "①韩信的忍是定价行为而非情绪反应：「孰视之」暴露了思考过程——把「尊严的即时兑付」与「未来的全部可能性」放在同一张表上称重，用期权价值碾压面子成本；②「杀之无名」是天才的清算语言：复仇必须有名目（回报对等的收益），否则只是情绪支出——他把「不杀」也纳入了成本收益框架，连宽恕都是计算的；③通鉴版本的深层线索：司马光把胯下之辱、漂母之恩、亭长之逐与「萧何追韩信、登坛拜将」编在同一叙事链条上——被全市场定价为「怯」的人，只有萧何式的深度对话能重估其真实价值（对照「萧何追韩信」案）；④反面警示：这一「忍」的操作系统终身运行，也终身负债——韩信一生在「被低估→需要承认」的叙事里打转（请立假齐王、羞与樊哙同列），胯下那口气的另一面，是他此后所有越界行为的人格注脚。",
  "outcome": {
    "short_term": "一市人皆笑；韩信继续贫困、寄食、受辱——期权尚未到期。",
    "long_term": "登坛拜将、还定三秦、破赵降燕、潍水灭龙且、垓下围项羽——四年之内，那个钻裤裆的人成为天下兵马的实际主人。而这份期权也有行权后的隐痛：钟室之祸（对照「蒯通说韩信」案）证明，能忍辱的人未必能容忍寻常，他的敌人从来不是那个屠户少年。"
  },
  "original_text": [
    { "quote": "初，淮阴人韩信，家贫，无行，不得推择为吏，又不能治生商贾，常从人寄食饮，人多厌之。……淮阴屠中少年有侮信者曰：「若虽长大，好带刀剑，中情怯耳。」因众辱之曰：「信能死，刺我；不能死，出我袴下！」于是信孰视之，俛出袴下，蒲伏。一市人皆笑信，以为怯。", "citation": "资治通鉴·卷九·汉纪一" }
  ],
  "insight": [
    "「孰视之」三个字是全案之眼：忍辱与懦弱的分界线在决策时间——花足够的时间把账算清再行动的，是策略；瞬间崩溃或瞬间爆发的，都是情绪。",
    "尊严与期权可以互相定价：当众受辱的折价是即期损失，你未来创造的价值是期权价值——止损点不在「丢不丢人」，在「这笔面子支出能不能换来更大的资产」。",
    "「杀之无名」教的是清算纪律：复仇、宽恕、翻脸、和解，都应有名目（对等的收益或成本），纯情绪动作是把人生账户交给别人操作。",
    "市场会对人贴错价，且错很久：一市人皆笑≠你错了——但重估从来不会自动发生，你需要一个「萧何」（深度了解你的决策者），或一场无法否认的战役。"
  ],
  "risks": [
    "本案例与史记版同源互补：史记版完整覆盖「受辱当街→忍→封楚中尉」全链路与复仇收尾，通鉴版侧重司马光的叙事编排与「底层处境」细节——两案对读，可见同一事件在不同史家笔下的功能差异（叙事学的现实版）。",
    "「忍辱」的行权风险不可忽视：韩信式隐忍的人格副作用（终身渴求承认、得势后的越界补偿）同样真实——现代语境里，长期压抑的屈辱感若无制度出口（申诉、换平台、心理支持），会以更危险的方式清算。",
    "现代职场的大多数「羞辱」场景没有生死杠杆：本库通篇提醒——忍是为了保住不可再生的未来期权；如果你的处境里并不存在那个「更大的未来」，止损离场才是对期权的正确处理。"
  ],
  "modern_scenarios": ["当众被羞辱的即时应对", "被全行业看低后的翻盘", "报复与宽恕的清算纪律", "被市场错误定价的人才"],
  "paired_cases": ["shiji-hanxin-kuaxia", "tongjian-simayi-zhuangbing", "shiji-xiaohe-zhuixin"],
  "keywords": ["胯下之辱", "忍辱", "羞辱", "被低估", "期权", "翻盘", "韩信", "孰视之", "面子", "报复", "宽恕", "定价"]
}
