{
  "id": "shiji-shusuntong-shizhu",
  "title": "叔孙通事十主：跟着「周期」走的人",
  "actors": ["叔孙通", "秦二世", "刘邦", "鲁两生"],
  "era": "秦末汉初",
  "source": { "book": "史记", "chapter": "刘敬叔孙通列传" },
  "kernel": ["站队择主", "变革树敌"],
  "situation": "叔孙通，薛人，秦时以文学征为待诏博士。陈胜起山东，二世召博士诸儒三十余人问策，诸生皆言「人臣无将，将即反，罪死无赦，愿陛下急发兵击之」——句句是道理，句句在打皇帝的脸。二世作色。此刻叔孙通站在人生的第一个分岔：跟真理走，还是跟现场走。此后十余年，他换了近十个老板（秦二世、项梁、义帝、项羽、刘邦……），被鲁地儒生骂为「所事者且十主，皆面谀以得亲贵」——他是那个时代跳槽最频繁、名声最差的人。",
  "options": [
    { "option": "同三十博士一起直言「反」", "assessment": "名节满分；二世怒而下狱者有之——道理正确与活到明天是两件事。" },
    { "option": "留在鲁地守先王之礼待明主（鲁两生路线）", "assessment": "清高安全；但舞台永远不会自己到来，且乱世里「待价」的结局多半是埋没。" },
    { "option": "按「时代阶段」切换供给：乱世荐壮士、治世定礼仪", "assessment": "名声折价巨大（面谀、十主）；但每一次切换都对准了当下需求结构，等来了「难与进取，可与守成」的窗口。" }
  ],
  "choice": "第一关：叔孙通前曰「诸生言皆非也」——把反叛定性为鼠窃狗盗，二世喜，赐帛拜博士；出宫即逃：「公不知也，我几不脱于虎口！」——他骗的是暴君，救的是满屋儒生。第二关：降汉时带儒生弟子百余人，却专言推荐群盗壮士，弟子窃骂，他答：「汉王方蒙矢石争天下，诸生宁能斗乎？故先言斩将搴旗之士。诸生且待我，我不忘矣。」第三关：天下已定，他说「夫儒者难与进取，可与守成」，采古礼与秦仪杂就朝仪；鲁两生拒行，骂其十主之臣，他笑曰「若真鄙儒也，不知时变」，带弟子走人。礼成之日，刘邦叹「吾乃今日知为皇帝之贵也」，拜叔孙通太常，弟子悉为郎。",
  "reasoning": "叔孙通的择主方法论：①他的「站队」对象其实不是某个老板，而是时代的需求周期——乱世里组织的痛是「缺能打的」，治世里组织的痛是「缺规矩的」，他切换的是自己的供给品；②为周期切换付名声折价：十主之臣、面谀之讥，他从不辩解，因为他清楚折价是暂时的、窗口是稍纵即逝的；③对追随者做预期管理：「我不忘矣」是给弟子的可验证承诺（日后弟子悉为郎，全额兑现）——他不靠情怀留人，靠信用留人；④识别不可救药的听众：鲁两生骂他，他不怒不劝——「不知时变」的人不值得营销，带着愿意走的人继续走。",
  "outcome": {
    "short_term": "定朝仪、拜太常、弟子为郎——十二年跳槽的折价一次性兑付；汉家朝廷自此有了规矩，皇帝第一次体验到「皇帝的贵」。",
    "long_term": "「叔孙通制礼」成为中国制度设计的原型案例：儒者难与进取、可与守成的分工论影响两千年。而「面谀事十主」的骂名同样跟了两千年——实用主义者的折价从不真正消失，它只是被功业暂时覆盖。"
  },
  "original_text": [
    { "quote": "叔孙通前曰：「诸生言皆非也。……」二世喜，乃赐帛二十匹，衣一袭，拜为博士。……通已出宫，反舍，诸生曰：「先生何言之谀也？」通曰：「公不知也，我几不脱于虎口！」", "citation": "史记·刘敬叔孙通列传" },
    { "quote": "弟子皆窃骂曰：「事先生数岁，幸得从降汉，今不能进臣等，专言大猾，何也？」叔孙通闻之，乃谓曰：「汉王方蒙矢石争天下，诸生宁能斗乎？故先言斩将搴旗之士。诸生且待我，我不忘矣。」", "citation": "史记·刘敬叔孙通列传" }
  ],
  "insight": [
    "择主的高级形态是择周期：先判断组织此刻最缺什么（进取期的执行力，守成期的制度力），再把你的供给品切换过去——跟对人不如跟对阶段。",
    "频繁切换要付名声折价，这是真实成本，不必自证清白——用可验证的承诺（「我不忘矣」）留住核心跟随者，用时间兑付一切。",
    "「难与进取，可与守成」：多数能力都有适用阶段，识别自己能力的季节，比什么都重要——制度型人才在创业期注定被冷落，反之亦然。",
    "遇到「不知时变」的批评者，不辩论，带着愿意走的人继续走——说服不了的人不是敌人，是另一条路线的居民。"
  ],
  "risks": [
    "「识时务」与「无底线」的分界线必须自己守住：叔孙通骗二世救人，李斯附沙丘夺位——同为实用主义，一个在选项内腾挪，一个伪造了选项本身。每次切换前自问：我妥协的是姿态，还是规则？",
    "现代对应是职业转型：从执行岗转制度岗、从增量行业转存量行业——转型越彻底，旧圈子骂声越大，折价期通常 2–3 年，入场前要有现金流与心理账户的准备。",
    "对跟随者公开承诺的兑现成本很高：说了「我不忘矣」，就要像叔孙通一样全额兑付，否则折价会翻倍变成欺诈标签。"
  ],
  "modern_scenarios": ["要不要从成熟公司跳去创业公司（或反向）", "职业转型期的名声折价怎么熬", "跟随老板换赛道还是守在原地", "实用主义与机会主义的分界线"],
  "paired_cases": ["tongjian-mayuan-zejun", "shiji-chenping-guihan", "shiji-lisi-shaqiu"],
  "keywords": ["跳槽", "择主", "识时务", "周期", "职业转型", "待价而沽", "制度设计", "十主", "时机", "名声折价", "儒生", "换赛道"]
}
