{
  "id": "shiji-xiangyu-wujiang",
  "title": "乌江自刎：「天之亡我」与拒绝过江的最后期权",
  "actors": ["项羽", "乌江亭长"],
  "era": "秦末",
  "source": { "book": "史记", "chapter": "项羽本纪" },
  "kernel": ["过度自信", "关键决断"],
  "situation": "垓下兵败、四面楚歌后，项羽率八百骑突围，至东城仅余二十八骑，被汉军数千骑围困。乌江亭长舣船以待：江东尚有千里之地、数十万之众，足以称王，且渡口只有这一条船。这是彻底失败后的最后一道选择题：渡江（接受耻辱、保留火种、不确定性中重来）还是不渡（维护身份叙事、即刻了结）。",
  "options": [
    { "option": "渡乌江，归江东，卷土重来", "assessment": "保留「重来」的期权——江东有基础人口与旧部情感；代价是接受一败涂地的现实身份，且汉军已控大势，重起胜率存疑。" },
    { "option": "不渡，力战而后自刎", "assessment": "以英雄叙事完成自我一致性（无颜见江东父老）；代价是把「可能性」清零，并留下一个固化了错误归因的终局样本。" }
  ],
  "choice": "项王笑曰：「天之亡我，我何渡为！」拒渡。将乌骓马赠亭长，令骑士下马步战，独杀汉军数百人，身被十余创，见故人吕马童，乃自刭。此前在东城他已两次对部众宣告「天之亡我，非战之罪」，并以一场快战证明「令诸君知天亡我，非战之罪也」。",
  "reasoning": "项羽的判断被三层东西锁死：①归因外化——把失败定性为天意而非己过（太史公评其「尚不觉寤而不自责」），归因于天即放弃复盘权，也放弃「下次可以不同」的可能；②身份包袱——「与江东子弟八千人渡江而西，今无一人还」，他把自我价值锚定在「带领他们出去又带他们回来」的完整性上，失败即身份破产；③情绪定价——乌江之「笑」不是清醒的权衡，是对已被固化的叙事的执行。这道题里他其实只计了面子成本，没计期权价值。",
  "outcome": {
    "short_term": "自刭而死，王翿取其头，汉军相争者死者数十人——以最惨烈的方式确认了「霸王」叙事的完整。",
    "long_term": "楚地皆降汉，天下归于刘邦。太史公盖棺：「自矜功伐，奋其私智而不师古……身死东城，尚不觉寤而不自责，过矣。乃引『天亡我，非用兵之罪也』，岂不谬哉！」后世「不肯过江东」成为千古之叹——叹息的正是那份被自己亲手清零的重来期权。"
  },
  "original_text": [
    { "quote": "项王乃悲歌慷慨，自为诗曰：「力拔山兮气盖世，时不利兮骓不逝。骓不逝兮可柰何，虞兮虞兮柰若何！」歌数阕，美人和之。项王泣数行下。", "citation": "史记·项羽本纪" },
    { "quote": "「吾起兵至今八岁矣，身七十余战，所当者破，所击者服，未尝败北，遂霸有天下。然今卒困于此，此天之亡我，非战之罪也。」", "citation": "史记·项羽本纪" },
    { "quote": "乌江亭长舣船待，曰：「江东虽小，地方千里，众数十万人，亦足王也。愿大王急渡。今独臣有船，汉军至，无以渡。」项王笑曰：「天之亡我，我何渡为！且籍与江东子弟八千人渡江而西，今无一人还，纵江东父兄怜而王我，我何面目见之？纵彼不言，籍独不愧于心乎？」", "citation": "史记·项羽本纪" },
    { "quote": "太史公曰：……「自矜功伐，奋其私智而不师古，谓霸王之业，欲以力征经营天下，五年卒亡其国，身死东城，尚不觉寤而不自责，过矣。乃引『天亡我，非用兵之罪也』，岂不谬哉！」", "citation": "史记·项羽本纪" }
  ],
  "insight": [
    "失败时归因于天、归于外，等于当场放弃复盘权——下一次开局你依然带着同一套操作系统。项羽从东城到乌江两次宣告「非战之罪」，说明归因偏差已从情绪固化为世界观。",
    "身份包袱在赢的时候是号召力，在输的时候是沉没成本的利息：越是「从来没输过」的人，越倾向于用「保住人设」替换「计算未来」。",
    "绝境中依然存在真实期权：只要还有一条船，就还有「从更低起点重新定价自己」的选择。清零期权的理由应当是期望值计算，而不是情绪与叙事。",
    "注意「快战」的迷惑性：项羽用一场战术胜利（二十八骑破数千）来反证战略判断（非战之罪）——用局部胜绩为整体失败辩护，是过度自信的经典收尾动作。"
  ],
  "risks": [
    "本案例的对照面同样重要：并非「什么都要重来」，创业/职业失败后是否再战，应基于资源、时机、团队的真实盘点，而非「必须证明自己」的叙事冲动——项羽的问题不是自责过度，而是从不真正自责。",
    "「无颜见江东父老」在现代的对应是「怕面对投资人/家人/老同事」——社交羞耻感是真实的决策成本，但它应该被计入，而不是直接替代计算。",
    "归因练习：连续三次把失败解释为「时机不好/环境不行/别人使坏」时，应强制做一次全内因复盘。"
  ],
  "modern_scenarios": ["创业彻底失败后，是清盘退出还是借壳再来", "重大失败后的归因方式决定能否复盘", "放不下人设与过去光环，拒绝降级重启", "用局部小胜为整体失败辩护"],
  "paired_cases": ["shiji-hongmen", "shiji-hanxin-kuaice", "tongjian-feishui-fujian"],
  "keywords": ["失败", "归因", "重来", "翻身", "复盘", "面子", "人设", "自刎", "不肯过江东", "期权", "绝境", "翻盘"]
}
