{
  "id": "shiji-lisi-shaqiu",
  "title": "沙丘之谋：巨大利益要求你越线一次",
  "actors": ["李斯", "赵高", "胡亥"],
  "era": "秦",
  "source": { "book": "史记", "chapter": "李斯列传" },
  "kernel": ["利益与底线"],
  "situation": "秦始皇死于沙丘，遗诏令长子扶苏归葬即位。诏书未发，知情者仅赵高、李斯、胡亥数人。赵高游说李斯篡改遗诏立胡亥。赵高的说辞直击要害：扶苏即位必用蒙恬为相，「君侯终不怀通侯之印归于乡里明矣」。李斯是帝国丞相，一人之下；他此刻要在「保住相位」与「守住臣节」间做选择。",
  "options": [
    { "option": "拒绝并公开遗诏，奉扶苏即位", "assessment": "守住底线与身后名；大概率失去相位（蒙恬替代），但以其功勋地位，身家性命未必不保。" },
    { "option": "与赵高合谋，矫诏立胡亥", "assessment": "保住相位于一时；但从此把身家性命抵押给两个共谋者——阴谋家赵高与昏庸的胡亥，且永远失去道义上的自我辩护能力。" }
  ],
  "choice": "李斯初拒：「安得亡国之言！此非人臣所当议也！」但在赵高反复攻击其利害要害后，「斯乃仰天而叹，垂泪太息」，最终「听高」，与之矫诏赐死扶苏、蒙恬，立胡亥。",
  "reasoning": "李斯明知是「亡国之言」（他自己说的），最终屈服的依据是纯粹的个人得失计算：赵高精准列举他五个方面不如蒙恬，戳中其「布衣入仕、最恐失去」的心理。他赌的是「越线一次，保住既得」，却没有计算：共谋关系中，掌握你把柄的人从此就是你的主人。",
  "outcome": {
    "short_term": "胡亥即位为二世，李斯保住丞相之位。",
    "long_term": "赵高既掌把柄又得帝宠，步步进逼。三年后李斯被赵高诬以谋反，「具斯五刑，论腰斩咸阳市」。临刑顾谓其中子曰：「吾欲与若复牵黄犬俱出上蔡东门逐狡兔，岂可得乎！」父子相哭，夷三族。秦亦二世而亡。"
  },
  "original_text": [
    { "quote": "斯曰：「安得亡国之言！此非人臣所当议也！」……高曰：「君侯自料能孰与蒙恬？功高孰与蒙恬？谋远不失孰与蒙恬？无怨于天下孰与蒙恬？长子旧而信之孰与蒙恬？」", "citation": "史记·李斯列传" },
    { "quote": "斯乃仰天而叹，垂泪太息曰：「嗟乎！独遭乱世，既以不能死，安讬命哉！」于是斯乃听高。", "citation": "史记·李斯列传" },
    { "quote": "二世二年七月，具斯五刑，论腰斩咸阳市。斯出狱，与其中子俱执，顾谓其中子曰：「吾欲与若复牵黄犬俱出上蔡东门逐狡兔，岂可得乎！」遂父子相哭，而夷三族。", "citation": "史记·李斯列传" }
  ],
  "insight": [
    "「就越线这一次」的真实价格不是那一次的风险，而是从此把人生的否决权交给共谋者——把柄是永久性负债。",
    "越线的收益（保住相位）是有上限的，越线的负债（受制于赵高）是无上限的；李斯用有限收益换了无限敞口。",
    "对手说服你越线时列举的全是你的「怕失去」；对损失的恐惧是底线失守的第一入口（损失厌恶被精准利用）。",
    "评估一项合谋时，最该问的不是「事能不能成」，而是「事成之后，同伙将如何处置我」。"
  ],
  "risks": [
    "不要反向推出「守住底线必有好报」——扶苏、蒙恬守了臣节同样被赐死。底线的价值主要不在于换取好结果，而在于不把命运交到最坏的人手里。",
    "现代场景中（假账、隐瞒、串标）越线的把柄同样永久存在，且有法律追诉；「事后洗白」的难度远超事前想象。",
    "警惕渐进式越线：第一步往往被包装为「灰色而非黑色」，李斯也是从「听一听赵高的分析」开始的。"
  ],
  "modern_scenarios": ["被要求配合财务造假换取晋升/保住职位", "合伙人提议隐瞒重大风险完成融资", "领导拉你参与灰色操作并暗示不从则出局"],
  "paired_cases": ["shiji-shangyang-zhaoliang"],
  "keywords": ["底线", "造假", "合谋", "把柄", "同流合污", "保住位置", "灰色地带", "被胁迫", "职业道德", "一次就好"]
}
