{
  "id": "shiji-chenping-guihan",
  "title": "去楚归汉：两易其主的跳槽逻辑",
  "actors": ["陈平", "项羽", "刘邦", "魏无知"],
  "era": "秦末汉初",
  "source": { "book": "史记", "chapter": "陈丞相世家" },
  "kernel": ["站队择主"],
  "situation": "陈平先事魏王咎，「说魏王不听，人或谗之」，遂去；转事项羽，得为都尉，但殷地得而复失后「项王怒，将诛定殷者将吏」，陈平惧诛，「封其金与印，使使归项王，而平身间行杖剑亡」，渡河投刘邦。此时刘邦弱于项羽，投汉是投弱侧；且他两易其主、又有「盗嫂受金」的舆论污点，第三次选择不能再错。",
  "options": [
    { "option": "留楚：项羽势大，但赏罚系于喜怒，「其所任爱，非诸项即妻之昆弟，虽有奇士不能用」", "assessment": "平台当下最强，但个人的容错空间为零（一次战败即面临诛杀），且晋升通道被宗亲垄断。" },
    { "option": "归汉：刘邦势弱，但「能饶人以爵邑」、不问出身来历、肯放权", "assessment": "平台弱小前途未卜，但个人能被使用、被容错——刘邦面对「盗嫂受金」的举报，问明白后「乃厚赐，拜为护军中尉，尽护诸将」。" },
    { "option": "退隐避乱", "assessment": "乱世中白身无以自保，且弃其纵横之才。" }
  ],
  "choice": "归汉。注意其离开项羽时的动作细节：「封其金与印，使使归项王」——把项羽给的赏赐和官印全部封还，再只身逃走。",
  "reasoning": "陈平后来对刘邦亲口对比过两个平台：「项王不能信人，其所任爱，非诸项即妻之昆弟，虽有奇士不能用……大王慢而少礼，士廉节者不来；然大王能饶人以爵邑，士之顽钝嗜利无耻者亦多归汉。」他的择主标准不是平台当下强弱，而是：①决策者能否信人、用人（授权结构）；②赏罚是否可预期（容错空间）；③晋升是否被血缘/亲信垄断（通道开放度）。封金挂印则是为了不留把柄、不欠人情，把跳槽的道义成本降到最低。",
  "outcome": {
    "short_term": "刘邦顶住诸将非议重用陈平，「尽护诸将」；陈平献计离间范增、项羽，范增疽发背死。",
    "long_term": "六出奇计定天下，惠帝、吕后、文帝三朝为相，善终——两易其主的「污点员工」成为汉初政坛存活能力最强的人之一。"
  },
  "original_text": [
    { "quote": "项王怒，将诛定殷者将吏。陈平惧诛，乃封其金与印，使使归项王，而平身间行杖剑亡。", "citation": "史记·陈丞相世家" },
    { "quote": "平曰：「臣事魏王，魏王不能用臣说，故去事项王。项王不能信人，其所任爱，非诸项即妻之昆弟，虽有奇士不能用，平乃去楚……诚臣计画有可采者，愿大王用之；使无可用者，金具在，请封输官，得请骸骨。」", "citation": "史记·陈丞相世家" },
    { "quote": "汉王召让平曰：「先生事魏不中，遂事楚而去，今又从吾游，信者固多心乎？」……汉王乃谢，厚赐，拜为护军中尉，尽护诸将。诸将乃不敢复言。", "citation": "史记·陈丞相世家" }
  ],
  "insight": [
    "择主/择平台的三个硬指标：授权结构（信不信外人）、容错空间（一次失败的代价）、通道开放度（关键位置是否被裙带垄断）——而非平台当下的强弱。",
    "强平台+零容错 劣于 弱平台+高容错，对「需要出手机会才能证明自己」的人尤其如此。",
    "离开的姿态决定下一段的信用：封金挂印、不带走资源，使「两易其主」没有变成「三姓家奴」的实锤。",
    "面对履历污点，陈平的答法是把评价权交给业绩（「计画有可采者愿用之，无可用者金具在」）——用可验证的产出对冲不可自证的人品指控。"
  ],
  "risks": [
    "「弱平台高容错」的判断依赖对决策者的近距离观察，跳槽前的信息远少于陈平（他在楚营任过职）；对未共事过的新老板，容错度承诺要打折。",
    "频繁跳槽的信用损耗是真实的，陈平也需要魏无知引荐+刘邦力排众议才落地；没有引荐人与护航者时，两次以上的短任期履历代价很高。",
    "投弱侧的历史成功案例耀眼，但弱侧的基础死亡率更高——刘邦是活下来的那一个，同期投奔其他弱势诸侯的谋士大多无闻而终。"
  ],
  "modern_scenarios": ["大厂螺丝钉 vs 初创核心成员的 offer 选择", "跳槽时如何评估新老板", "履历有污点/断档如何选下家"],
  "paired_cases": ["tongjian-chibi-zhanhe"],
  "keywords": ["跳槽", "选老板", "offer", "站队", "平台", "授权", "容错", "裙带", "履历污点", "择主"]
}
