{
  "id": "shiji-zhouyafu-end",
  "title": "真将军的代价：周亚夫的三次不肯低头",
  "actors": ["周亚夫", "汉文帝", "汉景帝"],
  "era": "西汉",
  "source": { "book": "史记", "chapter": "绛侯周勃世家" },
  "kernel": ["功高震主"],
  "situation": "周亚夫以细柳营治军得文帝激赏（「此真将军矣」），后以太尉三月平定七国之乱，功盖朝野，迁丞相。但他把军营里「军中闻将军令，不闻天子之诏」的刚直原样带进了朝堂：先后在废太子、封皇后兄王信为侯、封匈奴降王等事上硬顶景帝，「争之不得」便「因谢病」。景帝晚年为幼主计，最忌讳的恰是不可驯服的强臣。",
  "options": [
    { "option": "保持刚直，事事以原则硬顶皇帝", "assessment": "守住军人的原则与骄傲；但在皇权语境下，不可驯服的功臣本身就是罪名，与具体对错无关。" },
    { "option": "在非原则问题上示弱转圜（如萧何自污、张良自退的路线）", "assessment": "损失一些骄傲与话语权，但让君主确认「此人可控」，换取安全。" }
  ],
  "choice": "周亚夫始终选择前者。标志性一幕：景帝召他赐食，「独置大胾，无切肉，又不置櫡（筷子）」——这是一次驯服测试。周亚夫「心不平，顾谓尚席取櫡」，得筷即怏怏，「起，趋出」。景帝目送之曰：「此怏怏者非少主臣也！」测试结论就此写定。",
  "reasoning": "周亚夫的行为逻辑是军人式的：规则正确高于关系正确，认为功勋与正确性是护身符。他没有识别出「赐食不置筷」是测试而非怠慢——景帝要看的不是他饿不饿，而是受委屈时是否驯顺。他用真实反应给出了君主最不想要的答案。",
  "outcome": {
    "short_term": "「此怏怏者非少主臣也」之后，其政治生命实质终结。",
    "long_term": "后其子私购工官尚方甲楯为葬器，牵连周亚夫下狱。狱吏辱之：「君侯纵不反地上，即欲反地下耳。」周亚夫「因不食五日，呕血而死」，国除。一代真将军以绝食自证清白而终。"
  },
  "original_text": [
    { "quote": "文帝曰：「嗟乎，此真将军矣！曩者霸上、棘门军，若儿戏耳，其将固可袭而虏也。至于亚夫，可得而犯邪！」", "citation": "史记·绛侯周勃世家" },
    { "quote": "景帝居禁中，召条侯，赐食。独置大胾，无切肉，又不置櫡。条侯心不平，顾谓尚席取櫡。景帝视而笑曰：「此不足君所乎？」条侯免冠谢。上起，条侯因趋出。景帝以目送之，曰：「此怏怏者非少主臣也！」", "citation": "史记·绛侯周勃世家" },
    { "quote": "吏侵之益急……吏曰：「君侯纵不反地上，即欲反地下耳。」……因不食五日，呕血而死。", "citation": "史记·绛侯周勃世家" }
  ],
  "insight": [
    "组织顶层的忠诚测试常以「无理的小事」形式出现（不置筷子）；对强势下属，上位者测的从来不是能力，而是可控性。",
    "「我是对的」在权力关系中不是护身符；功劳越大，越需要主动提供「我可控」的证据（对照萧何自污、张良自退）。",
    "刚直是资产还是负债取决于场景：治军时「不闻天子之诏」成就他，朝堂上同一品质杀死他——环境切换时最危险的是把旧场景的成功行为带进新场景。",
    "「非少主臣」的视角提醒：你的安全评估不仅要算当前掌权者，还要算权力交接后的格局（景帝是在为幼主清场）。"
  ],
  "risks": [
    "本案不应推出「必须无底线顺从上级」；周亚夫的死因不是坚持原则本身，而是在无关原则的驯服测试上也拒绝任何弹性，且从不主动管理君主的安全感。",
    "现代组织中「不可控」的代价通常是边缘化而非性命，反抗的风险结构已根本不同；但「换 CEO/接班格局时清理强势老臣」的动力学依然存在。",
    "警惕反向教训：靠表演驯顺换安全，可能滑向失去全部原则（对照李斯）。健康解是区分「原则问题寸步不让、姿态问题充分弹性」。"
  ],
  "modern_scenarios": ["功勋高管与新任 CEO 的磨合", "被老板用小事试探态度", "公司接班/换帅期强势老臣的处境"],
  "paired_cases": ["shiji-zhangliang-tuiyin", "shiji-fanli-wenzhong"],
  "keywords": ["功高震主", "刚直", "情商", "试探", "服从性测试", "老臣", "接班", "边缘化", "原则", "可控"]
}
